,Title,Summary,DOI,Categories,Publish Time,Authors,Journal
95,Discovery of Newly Formed Broad Absorption Lines in a Radio-Loud Quasar,"We report a serendipitous discovery of broad absorption lines that were newly
formed in the spectrum of the high-redshift, luminous radio-loud quasar TEX
1726 + 344, in a time interval of only 12 years. This is the first quasar
showing a transition from narrow absorption lines to broad absorption lines. It
also becomes one of the few radio-loud broad absorption line quasars. The gas
cloud responsible for these broad absorption lines is derived to have
parameters coinciding with those of the remnant of a tidally disrupted star.",astro-ph/0208258v1,astro-ph,2002-08-13 17:04:25+00:00,[arxiv.Result.Author('Feng Ma')],Mon.Not.Roy.Astron.Soc. 335 (2002) L99
96,Controlling absorption resonances from sub-wavelength cylinder arrays,"The absorption and extinction spectra of sub-wavelength cylinder arrays are
shown to present two different kind of resonances. Close to the Rayleigh
anomalies, the diffractive coupling with the lattice periodicity leads to sharp
peaks in the extinction spectra with characteristic Fano line shapes for both s
and p-polarizations. When the material exhibits an absorption line or in the
presence of localized surface plasmon/polaritons, the system is shown to
present resonant absorption with wider and symmetric line shapes. For
s-polarization our analysis predicts a theoretical limit of 50 % of absorption.
Interestingly, for p-polarized light and an appropriate choice of parameters,
subwavelength cylinder arrays can present perfect (100 %) absorption.",physics/0606119v1,physics.optics,2006-06-14 09:32:50+00:00,"[arxiv.Result.Author('Marine Laroche'), arxiv.Result.Author('Raquel Gomez-Medina'), arxiv.Result.Author('Juan Jose Saenz')]",
97,Complete Bell state measurement with controlled photon absorption and quantum interference,"A solid state device to discriminate all the four Bell states is proposed.
The device is composed of controlled absorption crystals, rotators, and
retarders. The controlled absorption, where the state of one photon affects the
absorption of the other photon, is realized by two photon absorption in a cubic
crystal. The controlled absorption crystal detects a particular Bell state and
is transparent for the other Bell states. The rotators and retarders transform
a Bell state to another. This device may solve the problems in the early
quantum teleportation experiments in photon polarization states.",quant-ph/0006093v1,quant-ph,2000-06-21 05:44:00+00:00,[arxiv.Result.Author('A. Tomita')],
98,Multi-Channel Selective Femtosecond Coherent Control Based on Symmetry Properties,"We present and implement a new scheme for extended multi-channel selective
femtosecond coherent control based on symmetry properties of the excitation
channels. Here, an atomic non-resonant two-photon absorption channel is
coherently incorporated in a resonance-mediated (2+1) three-photon absorption
channel. By proper pulse shaping, utilizing the invariance of the two-photon
absorption to specific phase transformations of the pulse, the three-photon
absorption is tuned independently over order-of-magnitude yield range for any
possible two-photon absorption yield. Noticeable is a set of two-photon dark
pulses inducing widely-tunable three-photon absorption.",0710.0149v1,physics.atom-ph,2007-09-30 15:38:46+00:00,"[arxiv.Result.Author('Andrey Gandman'), arxiv.Result.Author('Lev Chuntonov'), arxiv.Result.Author('Leonid Rybak'), arxiv.Result.Author('Zohar Amitay')]","Phys. Rev. Lett. 100, 193002 (2008)"
99,Multi-spectral near perfect metamaterial absorbers using spatially multiplexed plasmon resonance metal square structures,"Near perfect infrared light absorption at multi-spectral wavelengths has been
experimentally demonstrated by using multiplexed metal square plasmon resonance
structures. Optical power absorption over 95% has been observed in dual-band
metamaterial absorbers at two separate wavelengths and optical power absorption
over 92.5% has been observed in triple-band metamaterial absorbers at three
separate wavelengths. The peak absorption wavelengths are primarily determined
by the sizes of the metal squares in the multiplexed structures. Electrical
field distributions in the middle of the dielectric spacer layer were
calculated at the peak absorption wavelengths. It is shown that strong light
absorption corresponds to the local quadrupole plasmon resonance modes in the
metamaterial structures.",1301.7142v1,physics.optics,2013-01-30 05:11:41+00:00,"[arxiv.Result.Author('Boyang Zhang'), arxiv.Result.Author('Joshua Hendrickson'), arxiv.Result.Author('Junpeng Guo')]",
100,Sets of Half-Average Nulls Generate Risk-Limiting Audits: SHANGRLA,"Risk-limiting audits (RLAs) for many social choice functions can be reduced
to testing sets of null hypotheses of the form ""the average of this list is not
greater than 1/2"" for a collection of finite lists of nonnegative numbers. Such
social choice functions include majority, super-majority, plurality,
multi-winner plurality, Instant Runoff Voting (IRV), Borda count, approval
voting, and STAR-Voting, among others. The audit stops without a full hand
count iff all the null hypotheses are rejected. The nulls can be tested in many
ways. Ballot-polling is particularly simple; two new ballot-polling
risk-measuring functions for sampling without replacement are given.
Ballot-level comparison audits transform each null into an equivalent assertion
that the mean of re-scaled tabulation errors is not greater than 1/2. In turn,
that null can then be tested using the same statistical methods used for ballot
polling---but applied to different finite lists of nonnegative numbers.
SHANGRLA comparison audits are more efficient than previous comparison audits
for two reasons: (i) for most social choice functions, the conditions tested
are both necessary and sufficient for the reported outcome to be correct, while
previous methods tested conditions that were sufficient but not necessary, and
(ii) the tests avoid a conservative approximation. The SHANGRLA abstraction
simplifies stratified audits, including audits that combine ballot polling with
ballot-level comparisons, producing sharper audits than the ""SUITE"" approach.
SHANGRLA works with the ""phantoms to evil zombies"" strategy to treat missing
ballot cards and missing or redacted cast vote records. That also facilitates
sampling from ""ballot-style manifests,"" which can dramatically improve
efficiency when the audited contests do not appear on every ballot card.
Open-source software implementing SHANGRLA ballot-level comparison audits is
available.",1911.10035v4,stat.AP,2019-11-22 13:32:46+00:00,[arxiv.Result.Author('Philip B. Stark')],
101,Limiting Risk by Turning Manifest Phantoms into Evil Zombies,"Drawing a random sample of ballots to conduct a risk-limiting audit generally
requires knowing how the ballots cast in an election are organized into groups,
for instance, how many containers of ballots there are in all and how many
ballots are in each container. A list of the ballot group identifiers along
with number of ballots in each group is called a ballot manifest. What if the
ballot manifest is not accurate? Surprisingly, even if ballots are known to be
missing from the manifest, it is not necessary to make worst-case assumptions
about those ballots--for instance, to adjust the margin by the number of
missing ballots--to ensure that the audit remains conservative. Rather, it
suffices to make worst-case assumptions about the individual randomly selected
ballots that the audit cannot find. This observation provides a simple
modification to some risk-limiting audit procedures that makes them
automatically become more conservative if the ballot manifest has errors. The
modification--phantoms to evil zombies (~2EZ)--requires only an upper bound on
the total number of ballots cast. ~2EZ makes the audit P-value stochastically
larger than it would be had the manifest been accurate, automatically requiring
more than enough ballots to be audited to offset the manifest errors. This
ensures that the true risk limit remains smaller than the nominal risk limit.
On the other hand, if the manifest is in fact accurate and the upper bound on
the total number of ballots equals the total according to the manifest, ~2EZ
has no effect at all on the number of ballots audited nor on the true risk
limit.",1207.3413v1,stat.AP,2012-07-14 11:26:02+00:00,"[arxiv.Result.Author('Jorge H. Banuelos'), arxiv.Result.Author('Philip B. Stark')]",
102,A Complete Enumeration of Ballot Permutations Avoiding Sets of Small Patterns,"Permutations whose prefixes contain at least as many ascents as descents are
called ballot permutations. Lin, Wang, and Zhao have previously enumerated
ballot permutations avoiding small patterns and have proposed the problem of
enumerating ballot permutations avoiding a pair of permutations of length $3$.
We completely enumerate ballot permutations avoiding two patterns of length $3$
and we relate these avoidance classes with their respective recurrence
relations and formulas, which leads to an interesting bijection between ballot
permutations avoiding $132$ and $312$ with left factors of Dyck paths. In
addition, we also conclude the Wilf-classification of ballot permutations
avoiding sets of two patterns of length $3$, and we then extend our results to
completely enumerate ballot permutations avoiding three patterns of length $3$.",2209.06087v1,math.CO,2022-09-13 15:37:45+00:00,[arxiv.Result.Author('Nathan Sun')],
103,Can Voters Detect Errors on Their Printed Ballots? Absolutely,"There is still debate on whether voters can detect malicious changes in their
printed ballot after making their selections on a Ballot Marking Device (BMD).
In this study, we altered votes on a voter's ballot after they had made their
selections on a BMD. We then required them to examine their ballots for any
changes from the slate they used to vote. Overall accuracy was exceptionally
high. Participants saw 1440 total contests, and of those 1440, there were a
total of 4 errors, so total accuracy was 99.8%. Participants were able to
perform with near-perfect accuracy regardless of ballot length, ballot type,
number of altered races, and location of altered races. Detection performance
was extremely robust. We conclude that with proper direction and resources,
voters can be near-perfect detectors of ballot changes on printed paper ballots
after voting with a BMD. This finding has significant implications for the
voting community as BMD use continues to grow. Research should now focus on
identifying administrative and behavioral methods that will prompt and
encourage voters to check their BMD-generated ballots before they drop them in
the ballot box.",2204.09780v1,cs.HC,2022-04-20 20:40:32+00:00,"[arxiv.Result.Author('Philip Kortum'), arxiv.Result.Author('Michael D. Byrne'), arxiv.Result.Author('Chidera O. Azubike'), arxiv.Result.Author('Laura E. Roty')]",
104,Ballot tilings and increasing trees,"We study enumerations of Dyck and ballot tilings, which are tilings of a
region determined by two Dyck or ballot paths. We give bijective proofs to two
formulae of enumerations of Dyck tilings through Hermite histories. We show
that one of the formulae is equal to a certain Kazhdan--Lusztig polynomial. For
a ballot tiling, we establish formulae which are analogues of formulae for Dyck
tilings. Especially, the generating functions have factorized expressions. The
key tool is a planted plane tree and its increasing labellings. We also
introduce a generalized perfect matching which is bijective to an Hermite
history for a ballot tiling. By combining these objects, we obtain various
expressions of a generating function of ballot tilings with a fixed lower path.",1705.06434v1,math-ph,2017-05-18 06:46:09+00:00,[arxiv.Result.Author('Keiichi Shigechi')],
105,Sophisticated Attacks on Decoy Ballots: The Devil's Menu and the Market for Lemons,"Decoy ballots do not count in election outcomes, but otherwise they are
indistinguishable from real ballots. By means of a game-theoretical model, we
show that decoy ballots may not provide effective protection against a
malevolent adversary trying to buy real ballots. If the citizenry is divided
into subgroups (or districts), the adversary can construct a so-called ""Devil's
Menu"" consisting of several prices. In equilibrium, the adversary can buy the
real ballots of any strict subset of districts at a price corresponding to the
willingness to sell on the part of the citizens holding such ballots. By
contrast, decoy voters are trapped into selling their ballots at a low, or even
negligible, price. Blowing up the adversary's budget by introducing decoy
ballots may thus turn out to be futile. The Devil's Menu can also be applied to
the well-known ""Lemons Problem"".",1712.05477v1,cs.GT,2017-12-14 23:54:58+00:00,"[arxiv.Result.Author('Hans Gersbach'), arxiv.Result.Author('Akaki Mamageishvili'), arxiv.Result.Author('Oriol Tejada')]",
106,The ATHENA Class of Risk-Limiting Ballot Polling Audits,"The main risk-limiting ballot polling audit in use today, BRAVO, is designed
for use when single ballots are drawn at random and a decision regarding
whether to stop the audit or draw another ballot is taken after each ballot
draw (ballot-by-ballot (B2) audits). On the other hand, real ballot polling
audits draw many ballots in a single round before determining whether to stop
(round-by-round (R2) audits). We show that BRAVO results in significant
inefficiency when directly applied to real R2 audits. We present the ATHENA
class of R2 stopping rules, which we show are risk-limiting if the round
schedule is pre-determined (before the audit begins). We prove that each rule
is at least as efficient as the corresponding BRAVO stopping rule applied at
the end of the round. We have open-source software libraries implementing most
of our results.
  We show that ATHENA halves the number of ballots required, for all state
margins in the 2016 US Presidential election and a first round with $90\%$
stopping probability, when compared to BRAVO (stopping rule applied at the end
of the round). We present simulation results supporting the 90% stopping
probability claims and our claims for the risk accrued in the first round.
Further, ATHENA reduces the number of ballots by more than a quarter for low
margins, when compared to the BRAVO stopping rule applied on ballots in
selection order. This implies that keeping track of the order when drawing
ballots R2 is not beneficial, because ATHENA is more efficient even without
information on selection order. These results are significant because current
approaches to real ballot polling election audits use the B2 BRAVO rules,
requiring about twice as much work on the part of election officials. Applying
the rules in selection order requires fewer ballots, but keeping track of the
order, and entering it into audit software, adds to the effort.",2008.02315v5,cs.CR,2020-08-05 18:47:37+00:00,"[arxiv.Result.Author('Filip Zagórski'), arxiv.Result.Author('Grant McClearn'), arxiv.Result.Author('Sarah Morin'), arxiv.Result.Author('Neal McBurnett'), arxiv.Result.Author('Poorvi L. Vora')]",
107,"Symmetric Dyck tilings, ballot tableaux and tree-like tableaux of shifted shapes","Symmetric Dyck tilings and ballot tilings are certain tilings in the region
surrounded by two ballot paths. We study the relations of combinatorial objects
which are bijective to symmetric Dyck tilings such as labeled trees, Hermite
histories, and perfect matchings. We also introduce two operations on labeled
trees for symmetric Dyck tilings: symmetric Dyck tiling strip (symDTS) and
symmetric Dyck tiling ribbon (symDTR). We give two definitions of Hermite
histories for symmetric Dyck tilings, and show that they are equivalent by use
of the correspondence between symDTS operation and an Hermite history. Since
ballot tilings form a subset in the set of symmetric Dyck tilings, we construct
an inclusive map from labeled trees for ballot tilings to labeled trees for
symmetric Dyck tilings. By this inclusive map, the results for symmetric Dyck
tilings can be applied to those of ballot tilings. We introduce and study the
notions of ballot tableaux and tree-like tableaux of shifted shapes, which are
generalizations of Dyck tableaux and tree-like tableaux, respectively. The
correspondence between ballot tableaux and tree-like tableaux of shifted shapes
is given by using the symDTR operation and the structure of labeled trees for
symmetric Dyck tilings.",2011.07296v1,math.CO,2020-11-14 13:15:14+00:00,[arxiv.Result.Author('Keiichi Shigechi')],
108,Bernoulli Ballot Polling: A Manifest Improvement for Risk-Limiting Audits,"We present a method and software for ballot-polling risk-limiting audits
(RLAs) based on Bernoulli sampling: ballots are included in the sample with
probability $p$, independently. Bernoulli sampling has several advantages: (1)
it does not require a ballot manifest; (2) it can be conducted independently at
different locations, rather than requiring a central authority to select the
sample from the whole population of cast ballots or requiring stratified
sampling; (3) it can start in polling places on election night, before margins
are known. If the reported margins for the 2016 U.S. Presidential election are
correct, a Bernoulli ballot-polling audit with a risk limit of 5% and a
sampling rate of $p_0 = 1\%$ would have had at least a 99% probability of
confirming the outcome in 42 states. (The other states were more likely to have
needed to examine additional ballots.) Logistical and security advantages that
auditing in the polling place affords may outweigh the cost of examining more
ballots than some other methods might require.",1812.06361v1,stat.AP,2018-12-15 21:57:23+00:00,"[arxiv.Result.Author('Kellie Ottoboni'), arxiv.Result.Author('Matthew Bernhard'), arxiv.Result.Author('J. Alex Halderman'), arxiv.Result.Author('Ronald L. Rivest'), arxiv.Result.Author('Philip B. Stark')]",
109,$k$-Cut: A Simple Approximately-Uniform Method for Sampling Ballots in Post-Election Audits,"We present an approximate sampling framework and discuss how risk-limiting
audits can compensate for these approximations, while maintaining their
""risk-limiting"" properties. Our framework is general and can compensate for
counting mistakes made during audits.
  Moreover, we present and analyze a simple approximate sampling
method,""$k$-cut"", for picking a ballot randomly from a stack, without counting.
Our method involves doing $k$ ""cuts"", each involving moving a random portion of
ballots from the top to the bottom of the stack, and then picking the ballot on
top. Unlike conventional methods of picking a ballot at random, $k$-cut does
not require identification numbers on the ballots or counting many ballots per
draw. We analyze how close the distribution of chosen ballots is to the uniform
distribution, and design different mitigation procedures. We show that $k=6$
cuts is enough for an risk-limiting election audit, based on empirical data,
which would provide a significant increase in efficiency.",1811.08811v3,cs.DS,2018-11-21 16:26:33+00:00,"[arxiv.Result.Author('Mayuri Sridhar'), arxiv.Result.Author('Ronald L. Rivest')]",
110,"Voter Verification of BMD Ballots Is a Two-Part Question: Can They? Mostly, They Can. Do They? Mostly, They Don't","The question of whether or not voters actually verify ballots produced by
ballot marking devices (BMDs) is presently the subject of some controversy.
Recent studies (e.g., Bernhard, et al. 2020) suggest the verification rate is
low. What is not clear from previous research is whether this is more a result
of voters being unable to do so accurately or whether this is because voters
simply choose not to attempt verification in the first place. In order to
understand this problem, we conducted an experiment in which 108 participants
participated in a mock election where the BMD displayed the voters' true
choices, but then changed a subset of those choices on the printed ballot. The
design of the printed ballot, the length of the ballot, the number of changes
that were made to the ballot, the location of those changes, and the
instructions provided to the voters were manipulated as part of the experiment.
Results indicated that of those voters who chose to examine the printed ballot,
76% detected anomalies, indicating that voters can reliably detect errors on
their ballot if they will simply review it. This suggests that administrative
remedies, rather than attempts to alter fundamental human perceptual
capabilities, could be employed to encourage voters to check their ballots,
which could prove as an effective countermeasure.",2003.04997v1,cs.HC,2020-03-10 21:06:42+00:00,"[arxiv.Result.Author('Philip Kortum'), arxiv.Result.Author('Michael D. Byrne'), arxiv.Result.Author('Julie Whitmore')]",
111,SOBA: Secrecy-preserving Observable Ballot-level Audit,"SOBA is an approach to election verification that provides observers with
justifiably high confidence that the reported results of an election are
consistent with an audit trail (""ballots""), which can be paper or electronic.
SOBA combines three ideas: (1) publishing cast vote records (CVRs) separately
for each contest, so that anyone can verify that each reported contest outcome
is correct, if the CVRs reflect voters' intentions with sufficient accuracy;
(2) shrouding a mapping between ballots and the CVRs for those ballots to
prevent the loss of privacy that could occur otherwise; (3) assessing the
accuracy with which the CVRs reflect voters' intentions for a collection of
contests while simultaneously assessing the integrity of the shrouded mapping
between ballots and CVRs by comparing randomly selected ballots to the CVRs
that purport to represent them. Step (1) is related to work by the Humboldt
County Election Transparency Project, but publishing CVRs separately for
individual contests rather than images of entire ballots preserves privacy.
Step (2) requires a cryptographic commitment from elections officials.
Observers participate in step (3), which relies on the ""super-simple
simultaneous single-ballot risk-limiting audit."" Step (3) is designed to reveal
relatively few ballots if the shrouded mapping is proper and the CVRs
accurately reflect voter intent. But if the reported outcomes of the contests
differ from the outcomes that a full hand count would show, step (3) is
guaranteed to have a large chance of requiring all the ballots to be counted by
hand, thereby limiting the risk that an incorrect outcome will become official
and final.",1105.5803v2,stat.AP,2011-05-29 17:00:20+00:00,"[arxiv.Result.Author('Josh Benaloh'), arxiv.Result.Author('Douglas Jones'), arxiv.Result.Author('Eric Lazarus'), arxiv.Result.Author('Mark Lindeman'), arxiv.Result.Author('Philip B. Stark')]",
112,"A decomposition of ballot permutations, pattern avoidance and Gessel walks","A permutation whose any prefix has no more descents than ascents is called a
ballot permutation. In this paper, we present a decomposition of ballot
permutations that enables us to construct a bijection between ballot
permutations and odd order permutations, which proves a set-valued extension of
a conjecture due to Spiro using the statistic of peak values. This bijection
also preserves the neighbors of the largest letter in permutations and thus
resolves a refinement of Spiro' s conjecture proposed by Wang and Zhang. Our
decomposition can be extended to well-labelled positive paths, a class of
generalized ballot permutations arising from polytope theory, that were
enumerated by Bernardi, Duplantier and Nadeau. We will also investigate the
enumerative aspect of ballot permutations avoiding a single pattern of length 3
and establish a connection between 213-avoiding ballot permutations and Gessel
walks.",2103.04599v1,math.CO,2021-03-08 08:37:08+00:00,"[arxiv.Result.Author('Zhicong Lin'), arxiv.Result.Author('David G. L. Wang'), arxiv.Result.Author('Tongyuan Zhao')]",
113,RAIRE: Risk-Limiting Audits for IRV Elections,"Risk-limiting post election audits guarantee a high probability of correcting
incorrect election results, independent of why the result was incorrect.
Ballot-polling audits select ballots at random and interpret those ballots as
evidence for and against the reported result, continuing this process until
either they support the recorded result, or they fall back to a full manual
recount. For elections with digitised scanning and counting of ballots, a
comparison audit compares randomly selected digital ballots with their paper
versions. Discrepancies are referred to as errors, and are used to build
evidence against or in support of the recorded result. Risk-limiting audits for
first-past-the-post elections are well understood, and used in some US
elections. We define a number of approaches to ballot-polling and comparison
risk-limiting audits for Instant Runoff Voting (IRV) elections. We show that
for almost all real elections we found, we can perform a risk-limiting audit by
looking at only a small fraction of the total ballots (assuming no errors were
made in the tallying and distribution of votes).",1903.08804v2,cs.DS,2019-03-20 06:19:10+00:00,"[arxiv.Result.Author('Michelle Blom'), arxiv.Result.Author('Peter J. Stuckey'), arxiv.Result.Author('Vanessa Teague')]",
