,Title,Summary,DOI,Categories,Publish Time,Authors,Journal
36,SOBA: Secrecy-preserving Observable Ballot-level Audit,"SOBA is an approach to election verification that provides observers with
justifiably high confidence that the reported results of an election are
consistent with an audit trail (""ballots""), which can be paper or electronic.
SOBA combines three ideas: (1) publishing cast vote records (CVRs) separately
for each contest, so that anyone can verify that each reported contest outcome
is correct, if the CVRs reflect voters' intentions with sufficient accuracy;
(2) shrouding a mapping between ballots and the CVRs for those ballots to
prevent the loss of privacy that could occur otherwise; (3) assessing the
accuracy with which the CVRs reflect voters' intentions for a collection of
contests while simultaneously assessing the integrity of the shrouded mapping
between ballots and CVRs by comparing randomly selected ballots to the CVRs
that purport to represent them. Step (1) is related to work by the Humboldt
County Election Transparency Project, but publishing CVRs separately for
individual contests rather than images of entire ballots preserves privacy.
Step (2) requires a cryptographic commitment from elections officials.
Observers participate in step (3), which relies on the ""super-simple
simultaneous single-ballot risk-limiting audit."" Step (3) is designed to reveal
relatively few ballots if the shrouded mapping is proper and the CVRs
accurately reflect voter intent. But if the reported outcomes of the contests
differ from the outcomes that a full hand count would show, step (3) is
guaranteed to have a large chance of requiring all the ballots to be counted by
hand, thereby limiting the risk that an incorrect outcome will become official
and final.",1105.5803v2,stat.AP,2011-05-29 17:00:20+00:00,"[arxiv.Result.Author('Josh Benaloh'), arxiv.Result.Author('Douglas Jones'), arxiv.Result.Author('Eric Lazarus'), arxiv.Result.Author('Mark Lindeman'), arxiv.Result.Author('Philip B. Stark')]",
37,"Voter Verification of BMD Ballots Is a Two-Part Question: Can They? Mostly, They Can. Do They? Mostly, They Don't","The question of whether or not voters actually verify ballots produced by
ballot marking devices (BMDs) is presently the subject of some controversy.
Recent studies (e.g., Bernhard, et al. 2020) suggest the verification rate is
low. What is not clear from previous research is whether this is more a result
of voters being unable to do so accurately or whether this is because voters
simply choose not to attempt verification in the first place. In order to
understand this problem, we conducted an experiment in which 108 participants
participated in a mock election where the BMD displayed the voters' true
choices, but then changed a subset of those choices on the printed ballot. The
design of the printed ballot, the length of the ballot, the number of changes
that were made to the ballot, the location of those changes, and the
instructions provided to the voters were manipulated as part of the experiment.
Results indicated that of those voters who chose to examine the printed ballot,
76% detected anomalies, indicating that voters can reliably detect errors on
their ballot if they will simply review it. This suggests that administrative
remedies, rather than attempts to alter fundamental human perceptual
capabilities, could be employed to encourage voters to check their ballots,
which could prove as an effective countermeasure.",2003.04997v1,cs.HC,2020-03-10 21:06:42+00:00,"[arxiv.Result.Author('Philip Kortum'), arxiv.Result.Author('Michael D. Byrne'), arxiv.Result.Author('Julie Whitmore')]",
38,Next Steps for the Colorado Risk-Limiting Audit (CORLA) Program,"Colorado conducted risk-limiting tabulation audits (RLAs) across the state in
2017, including both ballot-level comparison audits and ballot-polling audits.
Those audits only covered contests restricted to a single county; methods to
efficiently audit contests that cross county boundaries and combine ballot
polling and ballot-level comparisons have not been available.
  Colorado's current audit software (RLATool) needs to be improved to audit
these contests that cross county lines and to audit small contests efficiently.
  This paper addresses these needs. It presents extremely simple but
inefficient methods, more efficient methods that combine ballot polling and
ballot-level comparisons using stratified samples, and methods that combine
ballot-level comparison and variable-size batch comparison audits in a way that
does not require stratified sampling.
  We conclude with some recommendations, and illustrate our recommended method
using examples that compare them to existing approaches. Exemplar open-source
code and interactive Jupyter notebooks are provided that implement the methods
and allow further exploration.",1803.00698v1,stat.AP,2018-03-02 03:46:37+00:00,"[arxiv.Result.Author('Mark Lindeman'), arxiv.Result.Author('Neal McBurnett'), arxiv.Result.Author('Kellie Ottoboni'), arxiv.Result.Author('Philip B. Stark')]",
39,RAIRE: Risk-Limiting Audits for IRV Elections,"Risk-limiting post election audits guarantee a high probability of correcting
incorrect election results, independent of why the result was incorrect.
Ballot-polling audits select ballots at random and interpret those ballots as
evidence for and against the reported result, continuing this process until
either they support the recorded result, or they fall back to a full manual
recount. For elections with digitised scanning and counting of ballots, a
comparison audit compares randomly selected digital ballots with their paper
versions. Discrepancies are referred to as errors, and are used to build
evidence against or in support of the recorded result. Risk-limiting audits for
first-past-the-post elections are well understood, and used in some US
elections. We define a number of approaches to ballot-polling and comparison
risk-limiting audits for Instant Runoff Voting (IRV) elections. We show that
for almost all real elections we found, we can perform a risk-limiting audit by
looking at only a small fraction of the total ballots (assuming no errors were
made in the tallying and distribution of votes).",1903.08804v2,cs.DS,2019-03-20 06:19:10+00:00,"[arxiv.Result.Author('Michelle Blom'), arxiv.Result.Author('Peter J. Stuckey'), arxiv.Result.Author('Vanessa Teague')]",
40,Physical Cryptographic Signatures for Absentee Ballots,"Physical signature verification on absentee ballots became a major flashpoint
in the 2018 midterm elections in the United States, especially in states like
Georgia, Florida, and Arizona, where close election margins resulted in
heightened attention to the counting of absentee ballots. As vote-by-mail
solutions are becoming more prevalent across the U.S., these issues are sure to
continue affecting elections in the United States. Signature verification is an
inexact science; often times guidelines can vary widely from jurisdiction to
jurisdiction. In this paper we provide a cryptographic remedy to this solution
that is usable, secure, and easily integrated into existing election
infrastructure.",1812.09423v1,cs.CR,2018-12-22 00:43:31+00:00,[arxiv.Result.Author('Matthew Bernhard')],
41,Identifying Possible Winners in Ranked Choice Voting Elections with Outstanding Ballots,"Several election districts in the US have recently moved to ranked-choice
voting (RCV) to decide the results of local elections. RCV allows voters to
rank their choices, and the results are computed in rounds, eliminating one
candidate at a time. RCV ensures fairer elections and has been shown to
increase elected representation of women and people of color. A main drawback
of RCV is that the round-by-round process requires all the ballots to be
tallied before the results of an election can be calculated. With increasingly
large portions of ballots coming from absentee voters, RCV election outcomes
are not always apparent on election night, and can take several weeks to be
published, leading to a loss of trust in the electoral process from the public.
In this paper, we present an algorithm for efficiently computing possible
winners of RCV elections from partially known ballots and evaluate it on data
from the recent New York City Primary elections. We show that our techniques
allow to significantly narrow down the field of possible election winners, and
in some case identify the winner as soon as election night despite a number of
yet-unaccounted absentee ballots, providing more transparency in the electoral
process.",2206.12741v1,cs.CY,2022-06-25 22:08:15+00:00,"[arxiv.Result.Author('Alborz Jelvani'), arxiv.Result.Author('Amélie Marian')]",
42,A modular eballot system - V0.6,"We consider a reasonably simple voting system which can be implemented for
web-based ballots. Simplicity, modularity and the requirement of compatibility
with current web browsers leads to a system which satisfies a set of security
requirements for a ballot system which is not complete but sufficient in many
cases. Due to weak-eligibility and vote-selling, this system cannot be used for
political or similar ballots.",cs/0611066v2,cs.CR,2006-11-15 09:33:58+00:00,[arxiv.Result.Author('Andrea Pasquinucci')],
43,Ballot Length in Instant Runoff Voting,"Instant runoff voting (IRV) is an increasingly-popular alternative to
traditional plurality voting in which voters submit rankings over the
candidates rather than single votes. In practice, elections using IRV often
restrict the ballot length, the number of candidates a voter is allowed to rank
on their ballot. We theoretically and empirically analyze how ballot length can
influence the outcome of an election, given fixed voter preferences. We show
that there exist preference profiles over $k$ candidates such that up to $k-1$
different candidates win at different ballot lengths. We derive exact lower
bounds on the number of voters required for such profiles and provide a
construction matching the lower bound for unrestricted voter preferences.
Additionally, we characterize which sequences of winners are possible over
ballot lengths and provide explicit profile constructions achieving any
feasible winner sequence. We also examine how classic preference restrictions
influence our results--for instance, single-peakedness makes $k-1$ different
winners impossible but still allows at least $\Omega(\sqrt k)$. Finally, we
analyze a collection of 168 real-world elections, where we truncate rankings to
simulate shorter ballots. We find that shorter ballots could have changed the
outcome in one quarter of these elections. Our results highlight ballot length
as a consequential degree of freedom in the design of IRV elections.",2207.08958v3,cs.MA,2022-07-18 22:01:13+00:00,"[arxiv.Result.Author('Kiran Tomlinson'), arxiv.Result.Author('Johan Ugander'), arxiv.Result.Author('Jon Kleinberg')]",
44,Exploiting re-voting in the Helios election system,"Election systems must ensure that representatives are chosen by voters.
Moreover, each voter should have equal influence. Traditionally, this has been
achieved by permitting voters to cast at most one ballot. More recently, this
has been achieved by tallying the last ballot cast by each voter. We show this
is not achieved by the Helios election system, because an adversary can cause a
ballot other than a voter's last to be tallied. Moreover, we show how the
adversary can choose the contents of such a ballot, thus the adversary can
unduly influence the selection of representatives.",1612.04099v3,cs.CR,2016-12-13 11:07:22+00:00,"[arxiv.Result.Author('Maxime Meyer'), arxiv.Result.Author('Ben Smyth')]",
45,Non(c)esuch Ballot-Level Risk-Limiting Audits for Precinct-Count Voting Systems,"Risk-limiting audits (RLAs) guarantee a high probability of correcting
incorrect reported outcomes before the outcomes are certified. The most
efficient use ballot-level comparison, comparing the voting system's
interpretation of individual ballot cards sampled at random (cast-vote records,
CVRs) from a trustworthy paper trail to a human interpretation of the same
cards. Such comparisons require the voting system to create and export CVRs in
a way that can be linked to the individual ballots the CVRs purport to
represent. Such links can be created by keeping the ballots in the order in
which they are scanned or by printing a unique serial number on each ballot.
But for precinct-count systems (PCOS), these strategies may compromise vote
anonymity: the order in which ballots are cast may identify the voters who cast
them. Printing a unique pseudo-random number (""cryptographic nonce"") on each
ballot card after the voter last touches it could reduce such privacy risks.
But what if the system does not in fact print a unique number on each ballot or
does not accurately report the numbers it printed? This paper gives two ways to
conduct an RLA so that even if the system does not print a genuine nonce on
each ballot or misreports the nonces it used, the audit's risk limit is not
compromised (however, the anonymity of votes might be compromised). One method
allows untrusted technology to be used to imprint and to retrieve ballot cards.
The method is adaptive: if the technology behaves properly, this protection
does not increase the audit workload. But if the imprinting or retrieval system
misbehaves, the sample size the RLA requires to confirm the reported results
when the results are correct is generally larger than if the imprinting and
retrieval were accurate.",2207.01362v1,cs.CR,2022-07-04 12:35:42+00:00,[arxiv.Result.Author('Philip B. Stark')],
46,"More style, less work: card-style data decrease risk-limiting audit sample sizes","U.S. elections rely heavily on computers such as voter registration
databases, electronic pollbooks, voting machines, scanners, tabulators, and
results reporting websites. These introduce digital threats to election
outcomes. Risk-limiting audits (RLAs) mitigate threats to some of these systems
by manually inspecting random samples of ballot cards. RLAs have a large chance
of correcting wrong outcomes (by conducting a full manual tabulation of a
trustworthy record of the votes), but can save labor when reported outcomes are
correct. This efficiency is eroded when sampling cannot be targeted to ballot
cards that contain the contest(s) under audit. If the sample is drawn from all
cast cards, RLA sample sizes scale like the reciprocal of the fraction of
ballot cards that contain the contest(s) under audit. That fraction shrinks as
the number of cards per ballot grows (i.e., when elections contain more
contests) and as the fraction of ballots that contain the contest decreases
(i.e., when a smaller percentage of voters are eligible to vote in the
contest). States that conduct RLAs of contests on multi-card ballots or of
small contests can dramatically reduce sample sizes by using information about
which ballot cards contain which contests -- by keeping track of card-style
data (CSD). For instance, CSD reduces the expected number of draws needed to
audit a single countywide contest on a 4-card ballot by 75%. Similarly, CSD
reduces the expected number of draws by 95% or more for an audit of two
contests with the same margin on a 4-card ballot if one contest is on every
ballot and the other is on 10% of ballots. In realistic examples, the savings
can be several orders of magnitude.",2012.03371v1,cs.CR,2020-12-06 20:35:12+00:00,"[arxiv.Result.Author('Amanda K. Glazer'), arxiv.Result.Author('Jacob V. Spertus'), arxiv.Result.Author('Philip B. Stark')]",
47,"Feature Engineering for US State Legislative Hearings: Stance, Affiliation, Engagement and Absentees","In US State government legislatures, most of the activity occurs in
committees made up of lawmakers discussing bills. When analyzing, classifying
or summarizing these committee proceedings, some important features become
broadly interesting. In this paper, we engineer four useful features, two
applying to lawmakers (engagement and absence), and two to non-lawmakers
(stance and affiliation). We propose a system to automatically track the
affiliation of organizations in public comments and whether the organizational
representative supports or opposes the bill. The model tracking affiliation
achieves an F1 of 0.872 while the support determination has an F1 of 0.979.
Additionally, a metric to compute legislator engagement and absenteeism is also
proposed and as proof-of-concept, a list of the most and least engaged
legislators over one full California legislative session is presented.",2109.08855v1,cs.IR,2021-09-18 06:50:35+00:00,"[arxiv.Result.Author('Josh Grace'), arxiv.Result.Author('Foaad Khosmood')]",
48,How long is a piece of string? An exploration of multi-winner approval voting and ballot-length restrictions,"Multi-winner approval elections are seen in a variety of settings ranging
from academic societies and associations to public elections. In such
elections, it is often the case that ballot-length restrictions are enforced;
that is, where voters have a limit on the number of candidates which they can
vote for. Despite this common feature, there does not seem to be any
theoretical justification for ballot-length restrictions (Laslier and Van der
Straeten, 2016).
  This work endogenously derives the set of voter best-response ballot lengths
under complete information and with general assumptions on voter utilities and
voting rules. These results provide justification for some ballot-length
restrictions observed in practice, however when considering equilibrium
outcomes our analysis shows that this justification is no longer valid.
Equilibrium analysis is considered for voters with lazy and truth-bias
second-order tendencies and the equilibrium solution concept is pure-Nash
equilibria.
  The key insights show that ballot-length restrictions or institutional
features which make voting costly may lead to instability in election outcomes
when voters have diverse preferences, via the non-existence of equilibria. On
the other hand, when equilibria do exist they satisfy desirable properties
which are not guaranteed by equilibria attained under costless voting and in
the absence of ballot-length restrictions. In summary our results highlight a
stark trade-off between stable and desirable election outcomes.",1711.05092v1,cs.GT,2017-11-14 14:12:57+00:00,[arxiv.Result.Author('Barton E. Lee')],
49,Risk-Limiting Audits by Stratified Union-Intersection Tests of Elections (SUITE),"Risk-limiting audits (RLAs) offer a statistical guarantee: if a full manual
tally of the paper ballots would show that the reported election outcome is
wrong, an RLA has a known minimum chance of leading to a full manual tally.
RLAs generally rely on random samples. Stratified sampling--partitioning the
population of ballots into disjoint strata and sampling independently from the
strata--may simplify logistics or increase efficiency compared to simpler
sampling designs, but makes risk calculations harder. We present SUITE, a new
method for conducting RLAs using stratified samples. SUITE considers all
possible partitions of outcome-changing error across strata. For each
partition, it combines P-values from stratum-level tests into a combined
P-value; there is no restriction on the tests used in different strata. SUITE
maximizes the combined P-value over all partitions of outcome-changing error.
The audit can stop if that maximum is less than the risk limit. Voting systems
in some Colorado counties (comprising 98.2% of voters) allow auditors to check
how the system interpreted each ballot, which allows ballot-level comparison
RLAs. Other counties use ballot polling, which is less efficient. Extant
approaches to conducting an RLA of a statewide contest would require major
changes to Colorado's procedures and software, or would sacrifice the
efficiency of ballot-level comparison. SUITE does not. It divides ballots into
two strata: those cast in counties that can conduct ballot-level comparisons,
and the rest. Stratum-level P-values are found by methods derived here. The
resulting audit is substantially more efficient than statewide ballot polling.
SUITE is useful in any state with a mix of voting systems or that uses
stratified sampling for other reasons. We provide an open-source reference
implementation and exemplar calculations in Jupyter notebooks.",1809.04235v1,stat.AP,2018-09-12 02:56:22+00:00,"[arxiv.Result.Author('Kellie Ottoboni'), arxiv.Result.Author('Philip B. Stark'), arxiv.Result.Author('Mark Lindeman'), arxiv.Result.Author('Neal McBurnett')]",
50,Ballot stuffing and participation privacy in pollsite voting,"We study the problem of simultaneously addressing both ballot stuffing and
participation privacy for pollsite voting systems. Ballot stuffing is the
attack where fake ballots (not cast by any eligible voter) are inserted into
the system. Participation privacy is about hiding which eligible voters have
actually cast their vote. So far, the combination of ballot stuffing and
participation privacy has been mostly studied for internet voting, where voters
are assumed to own trusted computing devices. Such approaches are inapplicable
to pollsite voting where voters typically vote bare handed. We present an
eligibility audit protocol to detect ballot stuffing in pollsite voting
protocols. This is done while protecting participation privacy from a remote
observer - one who does not physically observe voters during voting. Our
protocol can be instantiated as an additional layer on top of most existing
pollsite E2E-V voting protocols. To achieve our guarantees, we develop an
efficient zero-knowledge proof (ZKP), that, given a value $v$ and a set $\Phi$
of commitments, proves $v$ is committed by some commitment in $\Phi$, without
revealing which one. We call this a ZKP of reverse set membership because of
its relationship to the popular ZKPs of set membership. This ZKP may be of
independent interest.",2210.14833v1,cs.CR,2022-10-26 16:29:23+00:00,"[arxiv.Result.Author('Prashant Agrawal'), arxiv.Result.Author('Abhinav Nakarmi'), arxiv.Result.Author('Mahabir Prasad Jhanwar'), arxiv.Result.Author('Subodh Sharma'), arxiv.Result.Author('Subhashis Banerjee')]",
51,Boardroom Voting: Verifiable Voting with Ballot Privacy Using Low-Tech Cryptography in a Single Room,"A boardroom election is an election that takes place in a single room -- the
boardroom -- in which all voters can see and hear each other. We present an
initial exploration of boardroom elections with ballot privacy and voter
verifiability that use only ""low-tech cryptography"" without using computers to
mark or collect ballots. Specifically, we define the problem, introduce several
building blocks, and propose a new protocol that combines these blocks in novel
ways. Our new building blocks include ""foldable ballots"" that can be rotated to
hide the alignment of ballot choices with voting marks, and ""visual secrets""
that are easy to remember and use but hard to describe. Although closely seated
participants in a boardroom election have limited privacy, the protocol ensures
that no one can determine how others voted. Moreover, each voter can verify
that their ballot was correctly cast, collected, and counted, without being
able to prove how they voted, providing assurance against undue influence.
Low-tech cryptography is useful in situations where constituents do not trust
computer technology, and it avoids the complex auditing requirements of
end-to-end cryptographic voting systems such as Pr\^{e}t-\`{a}-Voter. This
paper's building blocks and protocol are meant to be a proof of concept that
might be tested for usability and improved.",2007.14916v2,cs.CR,2020-07-29 15:40:51+00:00,"[arxiv.Result.Author('Enka Blanchard'), arxiv.Result.Author('Ted Selker'), arxiv.Result.Author('Alan T. Sherman')]",
52,Touchscreen Voting Machines Cause Long Lines and Disenfranchise Voters,"Computerized touchscreen ""Direct Recording Electronic"" DRE voting systems
have been used by over 1/3 of American voters in recent elections. In many
places, insufficient DRE numbers in combination with lengthy ballots and high
voter traffic have caused long lines and disenfranchised voters who left
without voting. We have applied computer queuing simulation to the voting
process and conclude that far more DREs, at great expense, would be needed to
keep waiting times low. Alternatively, paper ballot-optical scan systems can be
easily and economically scaled to prevent long lines and meet unexpected
contingencies.",0810.5577v1,stat.AP,2008-10-30 20:57:19+00:00,"[arxiv.Result.Author('William A. Edelstein'), arxiv.Result.Author('Arthur D. Edelstein')]",
53,Decentralized Verifiable Mail-in Ballot Counting for Postal Voting,"As computer vision is prevalently used for mail-in ballot processing and
counting, it becomes a point of centralized trust in postal voting. We propose
DVote, a prototype system of postal voting that provides decentralized trust in
computer vision. With blockchain and layer-2 technologies, DVote decentralizes
the computation and model training of computer vision to a group of scrutineers
that hold the AnyTrust assumption, i.e., at least one member is honest.
Consequently, the computational integrity is anchored to the trustworthiness of
a large public blockchain such as Ethereum.",2202.09122v1,cs.CR,2022-02-18 11:00:10+00:00,"[arxiv.Result.Author('Peichen Xie'), arxiv.Result.Author('Zihan Zheng'), arxiv.Result.Author('Xian Zhang'), arxiv.Result.Author('Shuo Chen')]",
