,Title,Summary,DOI,Categories,Publish Time,Authors,Journal
149,Optimization Helps Scheduling Nursing Staff at the Long-Term Care Homes of the City of Toronto,"The City of Toronto Long Term Care Homes & Services (LTCH&S) division is one
of the largest providers of long-term care in the Canadian province of Ontario,
providing care to 2,640 residents at 10 homes across Toronto. Our collaboration
with LTCH&S was initiated to facilitate the increasingly challenging task of
scheduling nursing staff and reduce high absenteeism rate observed among the
part-time nurses. We developed a spreadsheet-based scheduling tool to automate
the generation of schedules and incorporate nurses' preferences for different
shifts into the schedules. At the core of the scheduling tool is a hierarchical
optimization model that generates a feasible schedule with the highest total
preference score while satisfying the maximum possible demand. Feasible
schedules had to abide by a set of complex seniority requirements which
prioritized more senior nurses when allocating the available shifts. Our
scheduling tool was implemented in a 391-bed home in Toronto. The tool allowed
nursing managers to generate feasible schedules within a fraction of an hour,
in contrast to the status-quo manual approach which could took up to tens of
hours. In addition, the schedules successfully accounted for preferences with
on average above 94% of the allocated shifts ranked as most preferred.",2102.09461v1,cs.CY,2021-02-17 00:10:35+00:00,"[arxiv.Result.Author('Manion Anderson'), arxiv.Result.Author('Merve Bodur'), arxiv.Result.Author('Scott Rathwell'), arxiv.Result.Author('Vahid Sarhangian')]",
150,Energy Consumption Rate based Stable Election Protocol (ECRSEP) for WSNs,"In recent few yearsWireless Sensor Networks (WSNs) have seen an increased
interest in various applications like border field security, disaster
management and medical applications. So large number of sensor nodes are
deployed for such applications, which can work autonomously. Due to small power
batteries in WSNs, efficient utilization of battery power is an important
factor. Clustering is an efficient technique to extend life time of sensor
networks by reducing the energy consumption. In this paper, we propose a new
protocol; Energy Consumption Rate based Stable Election Protocol (ECRSEP). Our
CH selection scheme is based on the weighted election probabilities of each
node according to the Energy Consumption Rate (ECR) of each node. We compare
results of our proposed protocol with Low Energy Adaptive Clustering Hierarchy
(LEACH), Distributed Energy Efficient Clustering (DEEC), Stable Election
Protocol (SEP), and Enhanced SEP(ESEP). Our simulation results show that our
proposed protocol, ECRSEP outperforms all these protocols in terms of network
stability and network lifetime.",1303.5190v1,cs.NI,2013-03-21 08:32:12+00:00,"[arxiv.Result.Author('O. Rehman'), arxiv.Result.Author('N. Javaid'), arxiv.Result.Author('B. Manzoor'), arxiv.Result.Author('A. Hafeez'), arxiv.Result.Author('A. Iqbal'), arxiv.Result.Author('M. Ishfaq')]","International Workshop on Body Area Sensor Networks (BASNet-2013)
  in conjunction with 4th International Conference on Ambient Systems, Networks
  and Technologies (ANT 2013), 2013, Halifax, Nova Scotia, Canada"
151,The Impact of e-Politician on the Adoption of e-Service: Perceptions from a sample of South African Municipal IT Heads,"The purpose of this study is to establish whether the use of information
technology (IT) by elected municipal representatives, for constituency work,
emboldens the adoption of e-service in municipals of a developing country. The
research data was obtained through the completion of a questionnaire by a
sample of respondents who serve as authorities of IT in South African
municipals. The findings from both descriptive and inferential data analysis of
collected data confirm that the use of IT by elected municipal representatives
for constituency work impacts the adoption of e-service in municipals.
Furthermore, the use of IT by elected municipal representatives for
constituency work correlated with both e-service laws and e-service security.
This study contributes to a better understanding of choices needed when
planning for the adoption of e-service initiatives in municipals of developing
countries. Given that 87.2% of respondents are aware of a high access to
telephone mobile, a further research is needed to clarify why most elected
municipal representatives of a developing country choose not to exploit IT for
their constituency work, and similarly why municipals of a developing country
do not exploit IT to provide services.",1410.3200v1,cs.CY,2014-10-13 06:30:38+00:00,[arxiv.Result.Author('Ntjatji Gosebo')],"International Journal of Managing Public Sector Information and
  Communication Technologies (IJMPICT) Vol. 5, No. 3, pp 1-10, September 2014"
152,Cluster Based Cost Efficient Intrusion Detection System For Manet,"Mobile ad-hoc networks are temporary wireless networks. Network resources are
abnormally consumed by intruders. Anomaly and signature based techniques are
used for intrusion detection. Classification techniques are used in anomaly
based techniques. Intrusion detection techniques are used for the network
attack detection process. Two types of intrusion detection systems are
available. They are anomaly detection and signature based detection model. The
anomaly detection model uses the historical transactions with attack labels.
The signature database is used in the signature based IDS schemes.
  The mobile ad-hoc networks are infrastructure less environment. The intrusion
detection applications are placed in a set of nodes under the mobile ad-hoc
network environment. The nodes are grouped into clusters. The leader nodes are
assigned for the clusters. The leader node is assigned for the intrusion
detection process. Leader nodes are used to initiate the intrusion detection
process. Resource sharing and lifetime management factors are considered in the
leader election process. The system optimizes the leader election and intrusion
detection process.
  The system is designed to handle leader election and intrusion detection
process. The clustering scheme is optimized with coverage and traffic level.
Cost and resource utilization is controlled under the clusters. Node mobility
is managed by the system.",1311.1446v1,cs.CR,2013-11-06 16:59:06+00:00,"[arxiv.Result.Author('Saravanan Kumarasamy'), arxiv.Result.Author('Hemalatha B'), arxiv.Result.Author('Hashini P')]",
153,Nurse Staffing under Absenteeism: A Distributionally Robust Optimization Approach,"We study the nurse staffing problem under random nurse demand and
absenteeism. While the demand uncertainty is exogenous (stemming from the
random patient census), the absenteeism uncertainty is \emph{endogenous}, i.e.,
the number of nurses who show up for work partially depends on the nurse
staffing level. For quality of care, many hospitals have developed float pools,
i.e., groups of hospital units, and trained nurses to be able to work in
multiple units (termed cross-training) in response to potential nurse shortage.
In this paper, we propose a distributionally robust nurse staffing (DRNS) model
that considers both exogenous and endogenous uncertainties. We derive a
separation algorithm to solve this model under a general structure of float
pools. In addition, we identify several pool structures that often arise in
practice and recast the corresponding DRNS model as a mixed-integer linear
program, which facilitates off-the-shelf commercial solvers. Furthermore, we
optimize the float pool design to reduce cross-training while achieving
specified target staffing costs. The numerical case studies, based on the data
of a collaborating hospital, suggest that the units with high absenteeism
probability should be pooled together.",1909.09875v2,math.OC,2019-09-21 19:15:54+00:00,"[arxiv.Result.Author('Minseok Ryu'), arxiv.Result.Author('Ruiwei Jiang')]",
154,On the Bee-Identification Error Exponent with Absentee Bees,"The ""bee-identification problem"" was formally defined by Tandon, Tan and
Varshney [IEEE Trans. Commun. (2019) [Online early access]], and the error
exponent was studied. This work extends the results for the ""absentee bees""
scenario, where a small fraction of the bees are absent in the beehive image
used for identification. For this setting, we present an exact characterization
of the bee-identification error exponent, and show that independent barcode
decoding is optimal, i.e., joint decoding of the bee barcodes does not result
in a better error exponent relative to independent decoding of each noisy
barcode. This is in contrast to the result without absentee bees, where joint
barcode decoding results in a significantly higher error exponent than
independent barcode decoding. We also define and characterize the ""capacity""
for the bee-identification problem with absentee bees, and prove the strong
converse for the same.",1910.10333v1,cs.IT,2019-10-23 03:57:35+00:00,"[arxiv.Result.Author('Anshoo Tandon'), arxiv.Result.Author('Vincent Y. F. Tan'), arxiv.Result.Author('Lav R. Varshney')]",
155,Implementing Risk-Limiting Post-Election Audits in California,"Risk-limiting post-election audits limit the chance of certifying an
electoral outcome if the outcome is not what a full hand count would show.
Building on previous work, we report on pilot risk-limiting audits in four
elections during 2008 in three California counties: one during the February
2008 Primary Election in Marin County and three during the November 2008
General Elections in Marin, Santa Cruz and Yolo Counties. We explain what makes
an audit risk-limiting and how existing and proposed laws fall short. We
discuss the differences among our four pilot audits. We identify challenges to
practical, efficient risk-limiting audits and conclude that current approaches
are too complex to be used routinely on a large scale. One important logistical
bottleneck is the difficulty of exporting data from commercial election
management systems in a format amenable to audit calculations. Finally, we
propose a bare-bones risk-limiting audit that is less efficient than these
pilot audits, but avoids many practical problems.",0905.4691v4,stat.AP,2009-05-28 16:15:36+00:00,"[arxiv.Result.Author('Joseph Lorenzo Hall'), arxiv.Result.Author('Luke W. Miratrix'), arxiv.Result.Author('Philip B. Stark'), arxiv.Result.Author('Melvin Briones'), arxiv.Result.Author('Elaine Ginnold'), arxiv.Result.Author('Freddie Oakley'), arxiv.Result.Author('Martin Peaden'), arxiv.Result.Author('Gail Pellerin'), arxiv.Result.Author('Tom Stanionis'), arxiv.Result.Author('Tricia Webber')]",
156,Do Unions Shape Political Ideologies at Work?,"Labor unions' largest potential for political influence likely arises from
their direct connection to millions of individuals at the workplace. There they
may change the political views of both unionizing workers as well as of their
non-unionizing management which is arguably the most relevant out-group. In
this paper, we analyze the impact of unionization on workers' and managers'
campaign contributions at the workplace over the 1980-2016 period in the United
States. Therefore, we combine establishment-level union election data with
transaction-level campaign contributions to federal and local candidates. In
stacked Difference-in-Differences models, we find that unionization results in
a leftward shift of campaign contributions. Unionization increases the support
for Democrats relative to Republicans not only among workers but also among
managers. To test the validity of these findings, we perform Regression
Discontinuity exercises which show that there are no differential trends along
placebo vote share cutoffs and that the results hold when comparing
increasingly close elections. Moreover, we provide evidence that our results
are not driven by compositional changes of the workforce.",2209.02637v1,econ.GN,2022-09-06 16:45:51+00:00,"[arxiv.Result.Author('Johannes Matzat'), arxiv.Result.Author('Aiko Schmeißer')]",
157,SOS: Socially Omitting Selfishness in IoT for Smart and Connected Communities,"Smart and Connected Communities (SCC) is an emerging field of Internet of
Things (IoT), and it is having potential applications to improve human life.
The improvement may be in terms of preservation, revitalization, livability,
and sustainability of a community. The resources of the nodes and devices in
the SCC have certain constraints that may not allow the devices and nodes to
cooperate to save their resources such as memory, energy, and buffer, or simply
maximize their performance. Thus, to stimulate the nodes to avoid selfish
behavior, SSC needs a novel and well-organized solution to motivate nodes for
cooperation. This article aims to resolve the issue of selfish behaviors in SCC
and to encourage the nodes for cooperation. A novel mechanism Socially Omitting
Selfishness (SOS) has been proposed to manage/eradicate selfishness using a
socially-oriented election process. The election process elects different heads
based on weight and cooperation (using VCG model). The election of heads and
incentive mechanism encourages the nodes to show participation and behave as
highly cooperative members of the community. Furthermore, an extended version
of the Dempster-Shafer model has been used to discourage the selfish behavior
of the participating nodes in the SOS scheme. It uses different monitoring and
gateway nodes to efficiently employ the proposed scheme. A mathematical model
has been developed for the aforementioned aspects and simulated through the NS2
simulation environment to analyze the performance of SOS. The results of the
proposed scheme outperform the contemporary schemes in terms of average
delivery delay, packet delivery ratio, throughput, and average energy.",2004.08948v1,cs.DC,2020-04-19 20:01:23+00:00,"[arxiv.Result.Author('Ghani ur Rehman'), arxiv.Result.Author('Anwar Ghani'), arxiv.Result.Author('Muhammad Zubair'), arxiv.Result.Author('Muhammad Imran Saeed'), arxiv.Result.Author('Dhananjay Singh')]",
158,"Complexity of Manipulation, Bribery, and Campaign Management in Bucklin and Fallback Voting","A central theme in computational social choice is to study the extent to
which voting systems computationally resist manipulative attacks seeking to
influence the outcome of elections, such as manipulation (i.e., strategic
voting), control, and bribery. Bucklin and fallback voting are among the voting
systems with the broadest resistance (i.e., NP-hardness) to control attacks.
However, only little is known about their behavior regarding manipulation and
bribery attacks. We comprehensively investigate the computational resistance of
Bucklin and fallback voting for many of the common manipulation and bribery
scenarios; we also complement our discussion by considering several campaign
management problems for Bucklin and fallback.",1307.7322v1,cs.GT,2013-07-28 00:24:35+00:00,"[arxiv.Result.Author('Piotr Faliszewski'), arxiv.Result.Author('Yannick Reisch'), arxiv.Result.Author('Jörg Rothe'), arxiv.Result.Author('Lena Schend')]",
159,Architecture of Text Mining Application in Analyzing Public Sentiments of West Java Governor Election using Naive Bayes Classification,"The selection of West Java governor is one event that seizes the attention of
the public is no exception to social media users. Public opinion on a
prospective regional leader can help predict electability and tendency of
voters. Data that can be used by the opinion mining process can be obtained
from Twitter. Because the data is very varied form and very unstructured, it
must be managed and uninformed using data pre-processing techniques into
semi-structured data. This semi-structured information is followed by a
classification stage to categorize the opinion into negative or positive
opinions. The research methodology uses a literature study where the research
will examine previous research on a similar topic. The purpose of this study is
to find the right architecture to develop it into the application of twitter
opinion mining to know public sentiments toward the election of the governor of
west java. The result of this research is that Twitter opinion mining is part
of text mining where opinions in Twitter if they want to be classified, must go
through the preprocessing text stage first. The preprocessing step required
from twitter data is cleansing, case folding, POS Tagging and stemming. The
resulting text mining architecture is an architecture that can be used for text
mining research with different topics.",1810.07767v1,cs.CY,2018-09-20 07:14:10+00:00,"[arxiv.Result.Author('Suryanto Nugroho'), arxiv.Result.Author('Prihandoko')]",
160,Identifying Possible Winners in Ranked Choice Voting Elections with Outstanding Ballots,"Several election districts in the US have recently moved to ranked-choice
voting (RCV) to decide the results of local elections. RCV allows voters to
rank their choices, and the results are computed in rounds, eliminating one
candidate at a time. RCV ensures fairer elections and has been shown to
increase elected representation of women and people of color. A main drawback
of RCV is that the round-by-round process requires all the ballots to be
tallied before the results of an election can be calculated. With increasingly
large portions of ballots coming from absentee voters, RCV election outcomes
are not always apparent on election night, and can take several weeks to be
published, leading to a loss of trust in the electoral process from the public.
In this paper, we present an algorithm for efficiently computing possible
winners of RCV elections from partially known ballots and evaluate it on data
from the recent New York City Primary elections. We show that our techniques
allow to significantly narrow down the field of possible election winners, and
in some case identify the winner as soon as election night despite a number of
yet-unaccounted absentee ballots, providing more transparency in the electoral
process.",2206.12741v1,cs.CY,2022-06-25 22:08:15+00:00,"[arxiv.Result.Author('Alborz Jelvani'), arxiv.Result.Author('Amélie Marian')]",
161,On Covering a Solid Sphere with Concentric Spheres in ${\mathbb Z}^3$,"We show that a digital sphere, constructed by the circular sweep of a digital
semicircle (generatrix) around its diameter, consists of some holes
(absentee-voxels), which appear on its spherical surface of revolution. This
incompleteness calls for a proper characterization of the absentee-voxels whose
restoration will yield a complete spherical surface without any holes. In this
paper, we present a characterization of such absentee-voxels using certain
techniques of digital geometry and show that their count varies quadratically
with the radius of the semicircular generatrix. Next, we design an algorithm to
fill these absentee-voxels so as to generate a spherical surface of revolution,
which is more realistic from the viewpoint of visual perception. We further
show that covering a solid sphere by a set of complete spheres also results in
an asymptotically larger count of absentees, which is cubic in the radius of
the sphere. The characterization and generation of complete solid spheres
without any holes can also be accomplished in a similar fashion. We furnish
test results to substantiate our theoretical findings.",1411.1395v1,cs.CG,2014-10-23 05:05:23+00:00,"[arxiv.Result.Author('Sahadev Bera'), arxiv.Result.Author('Partha Bhowmick'), arxiv.Result.Author('Bhargab B. Bhattacharya')]",
162,Physical Cryptographic Signatures for Absentee Ballots,"Physical signature verification on absentee ballots became a major flashpoint
in the 2018 midterm elections in the United States, especially in states like
Georgia, Florida, and Arizona, where close election margins resulted in
heightened attention to the counting of absentee ballots. As vote-by-mail
solutions are becoming more prevalent across the U.S., these issues are sure to
continue affecting elections in the United States. Signature verification is an
inexact science; often times guidelines can vary widely from jurisdiction to
jurisdiction. In this paper we provide a cryptographic remedy to this solution
that is usable, secure, and easily integrated into existing election
infrastructure.",1812.09423v1,cs.CR,2018-12-22 00:43:31+00:00,[arxiv.Result.Author('Matthew Bernhard')],
163,Electoral Stability and Rigidity,"Some argue that political stability is best served through a two-party
system. This study refutes this. The author mathematically defines the
stability and rigidity of electoral systems comprised of any quantity of
electors and parties. In fact, stability is a function of the quantity of
electors - i.e., the number of occupied seats at the table. As the number of
electors increases, the properties of an electorate are increasingly well
resolved, and well described by those of an electorate that is least excessive
-- that is to say an electorate that is closest to equilibrium. Further,
electoral rigidity is a function of the quantity of parties and their
probabilities of representation. An absolutely rigid system admits no
fluctuations -- whatever happens to one elector will happen to all electors. As
the quantity of parties increases so does the number of party lines, and with
it the quantity of alternatives with which to respond to an external stimulus.
Rigidity is significant in a social system that places high value on party
loyalty. In conclusion, (i) electoral stability is best served by increasing
the quantity of electors; (ii) electoral rigidity is best served by decreasing
the quantity of parties, and by increasing the representation of some parties
at the expense of others; and (iii) the less stable a branch of government, the
more concern is placed on those who would hold those offices for the people.",1608.05038v1,q-fin.EC,2016-08-16 05:17:34+00:00,[arxiv.Result.Author('Michael Y. Levy')],
164,Nurse Staffing under Absenteeism: A Distributionally Robust Optimization Approach,"We study the nurse staffing problem under random nurse demand and
absenteeism. While the demand uncertainty is exogenous (stemming from the
random patient census), the absenteeism uncertainty is \emph{endogenous}, i.e.,
the number of nurses who show up for work partially depends on the nurse
staffing level. For quality of care, many hospitals have developed float pools,
i.e., groups of hospital units, and trained nurses to be able to work in
multiple units (termed cross-training) in response to potential nurse shortage.
In this paper, we propose a distributionally robust nurse staffing (DRNS) model
that considers both exogenous and endogenous uncertainties. We derive a
separation algorithm to solve this model under a general structure of float
pools. In addition, we identify several pool structures that often arise in
practice and recast the corresponding DRNS model as a mixed-integer linear
program, which facilitates off-the-shelf commercial solvers. Furthermore, we
optimize the float pool design to reduce cross-training while achieving
specified target staffing costs. The numerical case studies, based on the data
of a collaborating hospital, suggest that the units with high absenteeism
probability should be pooled together.",1909.09875v2,math.OC,2019-09-21 19:15:54+00:00,"[arxiv.Result.Author('Minseok Ryu'), arxiv.Result.Author('Ruiwei Jiang')]",
165,On the Bee-Identification Error Exponent with Absentee Bees,"The ""bee-identification problem"" was formally defined by Tandon, Tan and
Varshney [IEEE Trans. Commun. (2019) [Online early access]], and the error
exponent was studied. This work extends the results for the ""absentee bees""
scenario, where a small fraction of the bees are absent in the beehive image
used for identification. For this setting, we present an exact characterization
of the bee-identification error exponent, and show that independent barcode
decoding is optimal, i.e., joint decoding of the bee barcodes does not result
in a better error exponent relative to independent decoding of each noisy
barcode. This is in contrast to the result without absentee bees, where joint
barcode decoding results in a significantly higher error exponent than
independent barcode decoding. We also define and characterize the ""capacity""
for the bee-identification problem with absentee bees, and prove the strong
converse for the same.",1910.10333v1,cs.IT,2019-10-23 03:57:35+00:00,"[arxiv.Result.Author('Anshoo Tandon'), arxiv.Result.Author('Vincent Y. F. Tan'), arxiv.Result.Author('Lav R. Varshney')]",
