,Title,Summary,DOI,Categories,Publish Time,Authors,Journal
0,Identifying Possible Winners in Ranked Choice Voting Elections with Outstanding Ballots,"Several election districts in the US have recently moved to ranked-choice
voting (RCV) to decide the results of local elections. RCV allows voters to
rank their choices, and the results are computed in rounds, eliminating one
candidate at a time. RCV ensures fairer elections and has been shown to
increase elected representation of women and people of color. A main drawback
of RCV is that the round-by-round process requires all the ballots to be
tallied before the results of an election can be calculated. With increasingly
large portions of ballots coming from absentee voters, RCV election outcomes
are not always apparent on election night, and can take several weeks to be
published, leading to a loss of trust in the electoral process from the public.
In this paper, we present an algorithm for efficiently computing possible
winners of RCV elections from partially known ballots and evaluate it on data
from the recent New York City Primary elections. We show that our techniques
allow to significantly narrow down the field of possible election winners, and
in some case identify the winner as soon as election night despite a number of
yet-unaccounted absentee ballots, providing more transparency in the electoral
process.",2206.12741v1,cs.CY,2022-06-25 22:08:15+00:00,"[arxiv.Result.Author('Alborz Jelvani'), arxiv.Result.Author('Amélie Marian')]",
1,On Covering a Solid Sphere with Concentric Spheres in ${\mathbb Z}^3$,"We show that a digital sphere, constructed by the circular sweep of a digital
semicircle (generatrix) around its diameter, consists of some holes
(absentee-voxels), which appear on its spherical surface of revolution. This
incompleteness calls for a proper characterization of the absentee-voxels whose
restoration will yield a complete spherical surface without any holes. In this
paper, we present a characterization of such absentee-voxels using certain
techniques of digital geometry and show that their count varies quadratically
with the radius of the semicircular generatrix. Next, we design an algorithm to
fill these absentee-voxels so as to generate a spherical surface of revolution,
which is more realistic from the viewpoint of visual perception. We further
show that covering a solid sphere by a set of complete spheres also results in
an asymptotically larger count of absentees, which is cubic in the radius of
the sphere. The characterization and generation of complete solid spheres
without any holes can also be accomplished in a similar fashion. We furnish
test results to substantiate our theoretical findings.",1411.1395v1,cs.CG,2014-10-23 05:05:23+00:00,"[arxiv.Result.Author('Sahadev Bera'), arxiv.Result.Author('Partha Bhowmick'), arxiv.Result.Author('Bhargab B. Bhattacharya')]",
2,Physical Cryptographic Signatures for Absentee Ballots,"Physical signature verification on absentee ballots became a major flashpoint
in the 2018 midterm elections in the United States, especially in states like
Georgia, Florida, and Arizona, where close election margins resulted in
heightened attention to the counting of absentee ballots. As vote-by-mail
solutions are becoming more prevalent across the U.S., these issues are sure to
continue affecting elections in the United States. Signature verification is an
inexact science; often times guidelines can vary widely from jurisdiction to
jurisdiction. In this paper we provide a cryptographic remedy to this solution
that is usable, secure, and easily integrated into existing election
infrastructure.",1812.09423v1,cs.CR,2018-12-22 00:43:31+00:00,[arxiv.Result.Author('Matthew Bernhard')],
3,Nurse Staffing under Absenteeism: A Distributionally Robust Optimization Approach,"We study the nurse staffing problem under random nurse demand and
absenteeism. While the demand uncertainty is exogenous (stemming from the
random patient census), the absenteeism uncertainty is \emph{endogenous}, i.e.,
the number of nurses who show up for work partially depends on the nurse
staffing level. For quality of care, many hospitals have developed float pools,
i.e., groups of hospital units, and trained nurses to be able to work in
multiple units (termed cross-training) in response to potential nurse shortage.
In this paper, we propose a distributionally robust nurse staffing (DRNS) model
that considers both exogenous and endogenous uncertainties. We derive a
separation algorithm to solve this model under a general structure of float
pools. In addition, we identify several pool structures that often arise in
practice and recast the corresponding DRNS model as a mixed-integer linear
program, which facilitates off-the-shelf commercial solvers. Furthermore, we
optimize the float pool design to reduce cross-training while achieving
specified target staffing costs. The numerical case studies, based on the data
of a collaborating hospital, suggest that the units with high absenteeism
probability should be pooled together.",1909.09875v2,math.OC,2019-09-21 19:15:54+00:00,"[arxiv.Result.Author('Minseok Ryu'), arxiv.Result.Author('Ruiwei Jiang')]",
4,On the Bee-Identification Error Exponent with Absentee Bees,"The ""bee-identification problem"" was formally defined by Tandon, Tan and
Varshney [IEEE Trans. Commun. (2019) [Online early access]], and the error
exponent was studied. This work extends the results for the ""absentee bees""
scenario, where a small fraction of the bees are absent in the beehive image
used for identification. For this setting, we present an exact characterization
of the bee-identification error exponent, and show that independent barcode
decoding is optimal, i.e., joint decoding of the bee barcodes does not result
in a better error exponent relative to independent decoding of each noisy
barcode. This is in contrast to the result without absentee bees, where joint
barcode decoding results in a significantly higher error exponent than
independent barcode decoding. We also define and characterize the ""capacity""
for the bee-identification problem with absentee bees, and prove the strong
converse for the same.",1910.10333v1,cs.IT,2019-10-23 03:57:35+00:00,"[arxiv.Result.Author('Anshoo Tandon'), arxiv.Result.Author('Vincent Y. F. Tan'), arxiv.Result.Author('Lav R. Varshney')]",
5,Integration of a machine learning model into a decision support tool to predict absenteeism at work of prospective employees,"Purpose - Inefficient hiring may result in lower productivity and higher
training costs. Productivity losses caused by absenteeism at work cost U.S.
employers billions of dollars each year. Also, employers typically spend a
considerable amount of time managing employees who perform poorly. The purpose
of this study is to develop a decision support tool to predict absenteeism
among potential employees. Design/methodology/approach - We utilized a popular
open-access dataset. In order to categorize absenteeism classes, the data have
been preprocessed, and four methods of machine learning classification have
been applied: Multinomial Logistic Regression (MLR), Support Vector Machines
(SVM), Artificial Neural Networks (ANN), and Random Forests (RF). We selected
the best model, based on several validation scores, and compared its
performance against the existing model; we then integrated the best model into
our proposed web-based for hiring managers. Findings - A web-based decision
tool allows hiring managers to make more informed decisions before hiring a
potential employee, thus reducing time, financial loss and reducing the
probability of economic insolvency. Originality/value - In this paper, we
propose a model that is trained based on attributes that can be collected
during the hiring process. Furthermore, hiring managers may lack experience in
machine learning or do not have the time to spend developing machine learning
algorithms. Thus, we propose a web-based interactive tool that can be used
without prior knowledge of machine learning algorithms.",2202.03577v1,cs.LG,2022-02-02 03:49:01+00:00,"[arxiv.Result.Author('Gopal Nath'), arxiv.Result.Author('Antoine Harfouche'), arxiv.Result.Author('Austin Coursey'), arxiv.Result.Author('Krishna K. Saha'), arxiv.Result.Author('Srikanth Prabhu'), arxiv.Result.Author('Saptarshi Sengupta')]",
6,"Polarization, Abstention, and the Median Voter Theorem","The median voter theorem has long been the default model of voter behavior
and candidate choice. While contemporary work on the distribution of political
opinion has emphasized polarization and an increasing gap between the ""left""
and the ""right"" in democracies, the median voter theorem presents a model of
anti-polarization: competing candidates move to the center of the ideological
distribution to maximize vote share, regardless of the underlying ideological
distribution of voters. These anti-polar results, however, largely depend on
the ""singled-peakedness"" of voter preferences, an assumption that is rapidly
loosing relevance in the age of polarization. This article presents a model of
voter choice that examines three potential mechanisms that can undermine this
finding: a relative cost of voting that deters voters who are sufficiently
indifferent to both candidates, ideologically motivated third-party
alternatives that attract extreme voters, and a bimodal distribution of voter
ideology. Under reasonable sets of conditions and empirically observed voter
opinion distributions, these mechanisms can be sufficient to cause
strategically-minded candidates to fail to converge to the center, or to even
become more polarized than their electorate.",2103.12847v1,physics.soc-ph,2021-03-23 21:14:22+00:00,"[arxiv.Result.Author('Matthew I. Jones'), arxiv.Result.Author('Antonio D. Sirianni'), arxiv.Result.Author('Feng Fu')]",
7,A Fault Tolerance Improved Majority Voter for TMR System Architectures,"For digital system designs, triple modular redundancy (TMR), which is a
3-tuple version of N-modular redundancy is widely preferred for many
mission-control and safety-critical applications. The TMR scheme involves
two-times duplication of the simplex system hardware, with a majority voter
ensuring correctness provided at least two out of three copies of the system
remain operational. Thus the majority voter plays a pivotal role in ensuring
the correct operation of the system. The fundamental assumption implicit in the
TMR scheme is that the majority voter does not become faulty, which may not
hold well for implementations based on latest technology nodes with dimensions
of the order of just tens of nanometers. To overcome the drawbacks of the
classical majority voter some new voter designs were put forward in the
literature with the aim of enhancing the fault tolerance. However, these voter
designs generally ensure the correct system operation in the presence of either
a faulty function module or the faulty voter, considered only in isolation.
Since multiple faults may no longer be excluded in the nanoelectronics regime,
simultaneous fault occurrences on both the function module and the voter should
be considered, and the fault tolerance of the voters have to be analyzed under
such a scenario. In this context, this article proposes a new fault-tolerant
majority voter which is found to be more robust to faults than the existing
voters in the presence of faults occurring internally and/or externally to the
voter. Moreover, the proposed voter features less power dissipation, delay, and
area metrics based on the simulation results obtained by using a 32/28nm CMOS
process.",1605.03771v2,cs.AR,2016-05-12 11:54:44+00:00,"[arxiv.Result.Author('P Balasubramanian'), arxiv.Result.Author('K Prasad')]","WSEAS Transactions on Circuits and Systems, vol. 15, Article #14,
  pp. 108-122, 2016"
8,On the Computational Complexity of Variants of Combinatorial Voter Control in Elections,"Voter control problems model situations in which an external agent tries
toaffect the result of an election by adding or deleting the fewest number of
voters. The goal of the agent is to make a specific candidate either win
(\emph{constructive} control) or lose (\emph{destructive} control) the
election. We study the constructive and destructive voter control problems
whenadding and deleting voters have a \emph{combinatorial flavor}: If we add
(resp.\ delete) a voter~$v$, we also add (resp.\ delete) a bundle~$\kappa(v) $
of voters that are associated with~$v$. While the bundle~$\kappa(v)$ may have
more than one voter, a voter may also be associated with more than one voter.
We analyze the computational complexity of the four voter control problems for
the Plurality rule. We obtain that, in general, making a candidate lose is
computationally easier than making her win. In particular, if the bundling
relation is symmetric (i.e.\ $\forall w\colon w \in \kappa(v) \Leftrightarrow v
\in \kappa(w) $), and if each voter has at most two voters associated with him,
then destructive control is polynomial-time solvable while the constructive
variant remains $\NP$-hard. Even if the bundles are disjoint (i.e.\ $\forall
w\colon w \in \kappa(v) \Leftrightarrow \kappa(v) = \kappa(w) $), the
constructive problem variants remain intractable. Finally, the minimization
variant of constructive control by adding voters does not admit an efficient
approximation algorithm, unless P=NP.",1701.05108v1,cs.MA,2017-01-18 15:36:46+00:00,"[arxiv.Result.Author('Leon Kellerhals'), arxiv.Result.Author('Viatcheslav Korenwein'), arxiv.Result.Author('Philipp Zschoche'), arxiv.Result.Author('Robert Bredereck'), arxiv.Result.Author('Jiehua Chen')]",
9,Ranking Swing Voters in Congressional Elections,"We present a model for quantitatively identifying swing voters in
congressional elections. This is achieved by predicting an individual voter's
likelihood to vote and an individual voter's likelihood to vote for a given
party, if he votes. We make a rough prediction of these values. We then update
these predictions by incorporating information on a municipality wide basis via
aggregate data to enhance our estimate under the assumption that nearby voters
have similar behavior, which could be due to social interaction or common
external factors. Finally, we use a ranking scheme on these predictions to
identify two key types of voter: 1) Voters who are likely to vote that we can
convince to vote for a given party; and, 2) Voters who are likely to vote for a
given party, if they vote, that we can convince to actually turn out to vote.
Once these voters have been identified, a political campaign can use this
information to micro-target voters and win more votes.",1405.5111v1,physics.soc-ph,2014-05-19 06:30:42+00:00,[arxiv.Result.Author('Steven Ambadjes')],
10,2-Dimensional Euclidean Preferences,"A preference profile with m alternatives and n voters is 2-dimensional
Euclidean if both the alternatives and the voters can be placed into a
2-dimensional space such that for each pair of alternatives, every voter
prefers the one which has a shorter Euclidean distance to the voter. We study
how 2-dimensional Euclidean preference profiles depend on the values m and n.
We find that any profile with at most two voters or at most three alternatives
is 2-dimensional Euclidean while for three voters, we can show this property
for up to seven alternatives. The results are tight in terms of Bogomolnaia and
Laslier [2, Proposition 15(1)].",2205.14687v1,cs.GT,2022-05-29 15:06:14+00:00,"[arxiv.Result.Author('Laurent Bulteau'), arxiv.Result.Author('Jiehua Chen')]",
11,"Feature Engineering for US State Legislative Hearings: Stance, Affiliation, Engagement and Absentees","In US State government legislatures, most of the activity occurs in
committees made up of lawmakers discussing bills. When analyzing, classifying
or summarizing these committee proceedings, some important features become
broadly interesting. In this paper, we engineer four useful features, two
applying to lawmakers (engagement and absence), and two to non-lawmakers
(stance and affiliation). We propose a system to automatically track the
affiliation of organizations in public comments and whether the organizational
representative supports or opposes the bill. The model tracking affiliation
achieves an F1 of 0.872 while the support determination has an F1 of 0.979.
Additionally, a metric to compute legislator engagement and absenteeism is also
proposed and as proof-of-concept, a list of the most and least engaged
legislators over one full California legislative session is presented.",2109.08855v1,cs.IR,2021-09-18 06:50:35+00:00,"[arxiv.Result.Author('Josh Grace'), arxiv.Result.Author('Foaad Khosmood')]",
12,TRIP: Trustless Coercion-Resistant In-Person Voter Registration,"Most existing remote electronic voting systems are vulnerable to voter
coercion and vote buying. While coercion-resistant voting systems address this
challenge, current schemes assume that the voter has access to an untappable,
incorruptible device during voter registration. We present TRIP, an in-person
voter registration scheme enabling voters to create verifiable and
indistinguishable real and fake credentials using an untrusted kiosk inside a
privacy booth at a supervised location, e.g., the registrar's office. TRIP
ensures the integrity of the voter's real credential while enabling the
creation of fake credentials using interactive zero-knowledge proofs between
the voter as the verifier and the kiosk as the prover, unbeknownst to the
average voter. TRIP ensures that even voters who are under extreme coercion,
and cannot leave the booth with a real credential, can delegate their vote to a
political party, with the caveat that they must then trust the kiosk. TRIP
optimizes the tallying process by limiting the number of credentials a voter
can receive and capping the number of votes that a credential can cast per
election. We conduct a preliminary usability study among 41 participants at a
university and found that 42.5% of participants rated TRIP a B or higher in
usability, a promising result for a voter registration scheme that
substantially reduces trust in the registrar.",2202.06692v1,cs.CR,2022-02-14 13:35:46+00:00,"[arxiv.Result.Author('Louis-Henri Merino'), arxiv.Result.Author('Simone Colombo'), arxiv.Result.Author('Jeff Allen'), arxiv.Result.Author('Vero Estrada-Galiñanes'), arxiv.Result.Author('Bryan Ford')]",
13,Combinatorial Voter Control in Elections,"Voter control problems model situations such as an external agent trying to
affect the result of an election by adding voters, for example by convincing
some voters to vote who would otherwise not attend the election. Traditionally,
voters are added one at a time, with the goal of making a distinguished
alternative win by adding a minimum number of voters. In this paper, we
initiate the study of combinatorial variants of control by adding voters: In
our setting, when we choose to add a voter~$v$, we also have to add a whole
bundle $\kappa(v)$ of voters associated with $v$. We study the computational
complexity of this problem for two of the most basic voting rules, namely the
Plurality rule and the Condorcet rule.",1406.6859v1,cs.MA,2014-06-26 11:55:44+00:00,"[arxiv.Result.Author('Laurent Bulteau'), arxiv.Result.Author('Jiehua Chen'), arxiv.Result.Author('Piotr Faliszewski'), arxiv.Result.Author('Rolf Niedermeier'), arxiv.Result.Author('Nimrod Talmon')]",
14,A Parameterized Perspective on Protecting Elections,"We study the parameterized complexity of the optimal defense and optimal
attack problems in voting. In both the problems, the input is a set of voter
groups (every voter group is a set of votes) and two integers $k_a$ and $k_d$
corresponding to respectively the number of voter groups the attacker can
attack and the number of voter groups the defender can defend. A voter group
gets removed from the election if it is attacked but not defended. In the
optimal defense problem, we want to know if it is possible for the defender to
commit to a strategy of defending at most $k_d$ voter groups such that, no
matter which $k_a$ voter groups the attacker attacks, the outcome of the
election does not change. In the optimal attack problem, we want to know if it
is possible for the attacker to commit to a strategy of attacking $k_a$ voter
groups such that, no matter which $k_d$ voter groups the defender defends, the
outcome of the election is always different from the original (without any
attack) one.",1905.11838v1,cs.MA,2019-05-28 14:20:33+00:00,"[arxiv.Result.Author('Palash Dey'), arxiv.Result.Author('Neeldhara Misra'), arxiv.Result.Author('Swaprava Nath'), arxiv.Result.Author('Garima Shakya')]",
15,Wisdom of the Crowd Voting: Truthful Aggregation of Voter Information and Preferences,"We consider two-alternative elections where voters' preferences depend on a
state variable that is not directly observable. Each voter receives a private
signal that is correlated to the state variable. Voters may be ""contingent""
with different preferences in different states; or predetermined with the same
preference in every state. In this setting, even if every voter is a contingent
voter, agents voting according to their private information need not result in
the adoption of the universally preferred alternative, because the signals can
be systematically biased.
  We present an easy-to-deploy mechanism that elicits and aggregates the
private signals from the voters, and outputs the alternative that is favored by
the majority. In particular, voters truthfully reporting their signals forms a
strong Bayes Nash equilibrium (where no coalition of voters can deviate and
receive a better outcome).",2108.03749v1,cs.GT,2021-08-08 22:20:15+00:00,"[arxiv.Result.Author('Grant Schoenebeck'), arxiv.Result.Author('Biaoshuai Tao')]","Advances in Neural Information Processing Systems 2021, Vol. 34,
  Page 1872--1883"
16,k-Majority Digraphs and the Hardness of Voting with a Constant Number of Voters,"Many hardness results in computational social choice make use of the fact
that every directed graph may be induced as the pairwise majority relation of
some preference profile. However, this fact requires a number of voters that is
almost linear in the number of alternatives. It is therefore unclear whether
these results remain intact when the number of voters is bounded, as is, for
example, typically the case in search engine aggregation settings. In this
paper, we provide a systematic study of majority digraphs for a constant number
of voters resulting in analytical, experimental, and complexity-theoretic
insights. First, we characterize the set of digraphs that can be induced by two
and three voters, respectively, and give sufficient conditions for larger
numbers of voters. Second, we present a surprisingly efficient implementation
via SAT solving for computing the minimal number of voters that is required to
induce a given digraph and experimentally evaluate how many voters are required
to induce the majority digraphs of real-world and generated preference
profiles. Finally, we leverage our sufficient conditions to show that the
winner determination problem of various well-known voting rules remains hard
even when there is only a small constant number of voters. In particular, we
show that Kemeny's rule is hard to evaluate for 7 voters, while previous
methods could only establish such a result for constant even numbers of voters.",1704.06304v1,cs.GT,2017-04-20 19:04:28+00:00,"[arxiv.Result.Author('Georg Bachmeier'), arxiv.Result.Author('Felix Brandt'), arxiv.Result.Author('Christian Geist'), arxiv.Result.Author('Paul Harrenstein'), arxiv.Result.Author('Keyvan Kardel'), arxiv.Result.Author('Dominik Peters'), arxiv.Result.Author('Hans Georg Seedig')]",
17,Reputation-Driven Voting Dynamics,"We introduce the reputational voter model (RVM) to account for the
time-varying abilities of individuals to influence their neighbors. To
understand of the RVM, we first discuss the fitness voter model (FVM), in which
each voter has a fixed and distinct fitness. In a voting event where voter $i$
is fitter than voter $j$, only $j$ changes opinion. We show that the dynamics
of the FVM and the voter model are identical. We next discuss the adaptive
voter model (AVM), in which the influencing voter in a voting event increases
its fitness by a fixed amount. The dynamics of the AVM is non-stationary and
slowly crosses over to that of FVM because of the gradual broadening of the
fitness distribution of the population. Finally, we treat the RVM, in which the
voter $i$ is endowed with a reputational rank $r_i$ that ranges from 1 (highest
rank) to $N$ (lowest), where $N$ is the population size. In a voting event in
which voter $i$ outranks $j$, only the opinion of $j$ changes. Concomitantly,
the rank of $i$ increases, while that of $j$ does not change. The rank
distribution remains uniform on the integers $1,2,3,\ldots,N$, leading to
stationary dynamics. For equal number of voters in the two voting states with
these two subpopulations having the same average rand, the time to reach
consensus in the mean-field limit scales as $\exp(\sqrt{N})$. This long
consensus time arises because the average rank of the minority population is
typically higher than that of the majority. Thus whenever consensus is
approached, this highly ranked minority tends to drive the population away from
consensus.",1902.09371v2,physics.soc-ph,2019-02-22 18:19:16+00:00,"[arxiv.Result.Author('D. Bhat'), arxiv.Result.Author('S. Redner')]",J. Stat. Mech. (2019) 063208
