,Title,Summary,DOI,Categories,Publish Time,Authors,Journal
36,Locating ballot drop boxes,"For decades, voting-by-mail and the use of ballot drop boxes has
substantially grown, and in response, many election officials have added new
drop boxes to their voting infrastructure. However, existing guidance for
locating drop boxes is limited. In this paper, we introduce an integer
programming model, the drop box location problem (DBLP), to locate drop boxes.
The DBLP considers criteria of cost, voter access, and risk. The cost of the
drop box system is determined by the fixed cost of adding drop boxes and the
operational cost of a collection tour by a bipartisan team who regularly
collects ballots from selected locations. The DBLP utilizes covering sets to
ensure each voter is in close proximity to a drop box and incorporates a novel
measure of access to measure the ability to use multiple voting pathways to
vote. The DBLP is shown to be NP-Hard, and we introduce a heuristic to generate
a large number of feasible solutions for policy makers to select from a
posteriori. Using a real-world case study of Milwaukee, WI, we study the
benefit of the DBLP. The results demonstrate that the proposed optimization
model identifies drop box locations that perform well across multiple criteria.
The results also demonstrate that the trade-off between cost, access, and risk
is non-trivial, which supports the use of the proposed optimization-based
approach to select drop box locations.",2207.10707v2,math.OC,2022-07-21 18:41:38+00:00,"[arxiv.Result.Author('Adam P. Schmidt'), arxiv.Result.Author('Laura A. Albert')]",
37,Pandering in a Flexible Representative Democracy,"In representative democracies, the election of new representatives in regular
election cycles is meant to prevent corruption and other misbehavior by elected
officials and to keep them accountable in service of the ``will of the people.""
This democratic ideal can be undermined when candidates are dishonest when
campaigning for election over these multiple cycles or rounds of voting. Much
of the work on COMSOC to date has investigated strategic actions in only a
single round. We introduce a novel formal model of \emph{pandering}, or
strategic preference reporting by candidates seeking to be elected, and examine
the resilience of two democratic voting systems to pandering within a single
round and across multiple rounds. The two voting systems we compare are
Representative Democracy (RD) and Flexible Representative Democracy (FRD). For
each voting system, our analysis centers on the types of strategies candidates
employ and how voters update their views of candidates based on how the
candidates have pandered in the past. We provide theoretical results on the
complexity of pandering in our setting for a single cycle, formulate our
problem for multiple cycles as a Markov Decision Process, and use reinforcement
learning to study the effects of pandering by both single candidates and groups
of candidates across a number of rounds.",2211.09986v1,cs.MA,2022-11-18 02:19:28+00:00,"[arxiv.Result.Author('Xiaolin Sun'), arxiv.Result.Author('Jacob Masur'), arxiv.Result.Author('Ben Abramowitz'), arxiv.Result.Author('Nicholas Mattei'), arxiv.Result.Author('Zizhan Zheng')]",
38,Cross-lingual Extended Named Entity Classification of Wikipedia Articles,"The FPT.AI team participated in the SHINRA2020-ML subtask of the NTCIR-15
SHINRA task. This paper describes our method to solving the problem and
discusses the official results. Our method focuses on learning cross-lingual
representations, both on the word level and document level for page
classification. We propose a three-stage approach including multilingual model
pre-training, monolingual model fine-tuning and cross-lingual voting. Our
system is able to achieve the best scores for 25 out of 30 languages; and its
accuracy gaps to the best performing systems of the other five languages are
relatively small.",2010.03424v2,cs.CL,2020-10-07 14:06:09+00:00,"[arxiv.Result.Author('The Viet Bui'), arxiv.Result.Author('Phuong Le-Hong')]",
39,Nurse Staffing under Absenteeism: A Distributionally Robust Optimization Approach,"We study the nurse staffing problem under random nurse demand and
absenteeism. While the demand uncertainty is exogenous (stemming from the
random patient census), the absenteeism uncertainty is \emph{endogenous}, i.e.,
the number of nurses who show up for work partially depends on the nurse
staffing level. For quality of care, many hospitals have developed float pools,
i.e., groups of hospital units, and trained nurses to be able to work in
multiple units (termed cross-training) in response to potential nurse shortage.
In this paper, we propose a distributionally robust nurse staffing (DRNS) model
that considers both exogenous and endogenous uncertainties. We derive a
separation algorithm to solve this model under a general structure of float
pools. In addition, we identify several pool structures that often arise in
practice and recast the corresponding DRNS model as a mixed-integer linear
program, which facilitates off-the-shelf commercial solvers. Furthermore, we
optimize the float pool design to reduce cross-training while achieving
specified target staffing costs. The numerical case studies, based on the data
of a collaborating hospital, suggest that the units with high absenteeism
probability should be pooled together.",1909.09875v2,math.OC,2019-09-21 19:15:54+00:00,"[arxiv.Result.Author('Minseok Ryu'), arxiv.Result.Author('Ruiwei Jiang')]",
40,Physical Cryptographic Signatures for Absentee Ballots,"Physical signature verification on absentee ballots became a major flashpoint
in the 2018 midterm elections in the United States, especially in states like
Georgia, Florida, and Arizona, where close election margins resulted in
heightened attention to the counting of absentee ballots. As vote-by-mail
solutions are becoming more prevalent across the U.S., these issues are sure to
continue affecting elections in the United States. Signature verification is an
inexact science; often times guidelines can vary widely from jurisdiction to
jurisdiction. In this paper we provide a cryptographic remedy to this solution
that is usable, secure, and easily integrated into existing election
infrastructure.",1812.09423v1,cs.CR,2018-12-22 00:43:31+00:00,[arxiv.Result.Author('Matthew Bernhard')],
41,Identifying Possible Winners in Ranked Choice Voting Elections with Outstanding Ballots,"Several election districts in the US have recently moved to ranked-choice
voting (RCV) to decide the results of local elections. RCV allows voters to
rank their choices, and the results are computed in rounds, eliminating one
candidate at a time. RCV ensures fairer elections and has been shown to
increase elected representation of women and people of color. A main drawback
of RCV is that the round-by-round process requires all the ballots to be
tallied before the results of an election can be calculated. With increasingly
large portions of ballots coming from absentee voters, RCV election outcomes
are not always apparent on election night, and can take several weeks to be
published, leading to a loss of trust in the electoral process from the public.
In this paper, we present an algorithm for efficiently computing possible
winners of RCV elections from partially known ballots and evaluate it on data
from the recent New York City Primary elections. We show that our techniques
allow to significantly narrow down the field of possible election winners, and
in some case identify the winner as soon as election night despite a number of
yet-unaccounted absentee ballots, providing more transparency in the electoral
process.",2206.12741v1,cs.CY,2022-06-25 22:08:15+00:00,"[arxiv.Result.Author('Alborz Jelvani'), arxiv.Result.Author('Amélie Marian')]",
42,Distributed Learning over a Wireless Network with Non-coherent Majority Vote Computation,"In this study, we propose an over-the-air computation (OAC) scheme to
calculate the majority vote (MV) for federated edge learning (FEEL). With the
proposed approach, edge devices (EDs) transmit the signs of local stochastic
gradients, i.e., votes, by activating one of two orthogonal resources. The MVs
at the edge server (ES) are obtained with non-coherent detectors by exploiting
the accumulations on the resources. Hence, the proposed scheme eliminates the
need for channel state information (CSI) at the EDs and ES. In this study, we
analyze various gradient-encoding strategies through the weight functions and
waveform configurations over orthogonal frequency division multiplexing (OFDM).
We show that specific weight functions that enable absentee EDs (i.e.,
hard-coded participation with absentees (HPA)) or weighted votes (i.e.,
soft-coded participation (SP)) can substantially reduce the probability of
detecting the incorrect MV. By taking path loss, power control, cell size, and
fading channel into account, we prove the convergence of the distributed
learning for a non-convex function for HPA. Through simulations, we show that
the proposed scheme with HPA and SP can provide high test accuracy even when
the time-synchronization and the power control are not ideal under
heterogeneous data distribution scenarios.",2209.04692v2,cs.IT,2022-09-10 15:25:45+00:00,[arxiv.Result.Author('Alphan Sahin')],
43,On Covering a Solid Sphere with Concentric Spheres in ${\mathbb Z}^3$,"We show that a digital sphere, constructed by the circular sweep of a digital
semicircle (generatrix) around its diameter, consists of some holes
(absentee-voxels), which appear on its spherical surface of revolution. This
incompleteness calls for a proper characterization of the absentee-voxels whose
restoration will yield a complete spherical surface without any holes. In this
paper, we present a characterization of such absentee-voxels using certain
techniques of digital geometry and show that their count varies quadratically
with the radius of the semicircular generatrix. Next, we design an algorithm to
fill these absentee-voxels so as to generate a spherical surface of revolution,
which is more realistic from the viewpoint of visual perception. We further
show that covering a solid sphere by a set of complete spheres also results in
an asymptotically larger count of absentees, which is cubic in the radius of
the sphere. The characterization and generation of complete solid spheres
without any holes can also be accomplished in a similar fashion. We furnish
test results to substantiate our theoretical findings.",1411.1395v1,cs.CG,2014-10-23 05:05:23+00:00,"[arxiv.Result.Author('Sahadev Bera'), arxiv.Result.Author('Partha Bhowmick'), arxiv.Result.Author('Bhargab B. Bhattacharya')]",
44,Nurse Staffing under Absenteeism: A Distributionally Robust Optimization Approach,"We study the nurse staffing problem under random nurse demand and
absenteeism. While the demand uncertainty is exogenous (stemming from the
random patient census), the absenteeism uncertainty is \emph{endogenous}, i.e.,
the number of nurses who show up for work partially depends on the nurse
staffing level. For quality of care, many hospitals have developed float pools,
i.e., groups of hospital units, and trained nurses to be able to work in
multiple units (termed cross-training) in response to potential nurse shortage.
In this paper, we propose a distributionally robust nurse staffing (DRNS) model
that considers both exogenous and endogenous uncertainties. We derive a
separation algorithm to solve this model under a general structure of float
pools. In addition, we identify several pool structures that often arise in
practice and recast the corresponding DRNS model as a mixed-integer linear
program, which facilitates off-the-shelf commercial solvers. Furthermore, we
optimize the float pool design to reduce cross-training while achieving
specified target staffing costs. The numerical case studies, based on the data
of a collaborating hospital, suggest that the units with high absenteeism
probability should be pooled together.",1909.09875v2,math.OC,2019-09-21 19:15:54+00:00,"[arxiv.Result.Author('Minseok Ryu'), arxiv.Result.Author('Ruiwei Jiang')]",
45,On the Bee-Identification Error Exponent with Absentee Bees,"The ""bee-identification problem"" was formally defined by Tandon, Tan and
Varshney [IEEE Trans. Commun. (2019) [Online early access]], and the error
exponent was studied. This work extends the results for the ""absentee bees""
scenario, where a small fraction of the bees are absent in the beehive image
used for identification. For this setting, we present an exact characterization
of the bee-identification error exponent, and show that independent barcode
decoding is optimal, i.e., joint decoding of the bee barcodes does not result
in a better error exponent relative to independent decoding of each noisy
barcode. This is in contrast to the result without absentee bees, where joint
barcode decoding results in a significantly higher error exponent than
independent barcode decoding. We also define and characterize the ""capacity""
for the bee-identification problem with absentee bees, and prove the strong
converse for the same.",1910.10333v1,cs.IT,2019-10-23 03:57:35+00:00,"[arxiv.Result.Author('Anshoo Tandon'), arxiv.Result.Author('Vincent Y. F. Tan'), arxiv.Result.Author('Lav R. Varshney')]",
46,Integration of a machine learning model into a decision support tool to predict absenteeism at work of prospective employees,"Purpose - Inefficient hiring may result in lower productivity and higher
training costs. Productivity losses caused by absenteeism at work cost U.S.
employers billions of dollars each year. Also, employers typically spend a
considerable amount of time managing employees who perform poorly. The purpose
of this study is to develop a decision support tool to predict absenteeism
among potential employees. Design/methodology/approach - We utilized a popular
open-access dataset. In order to categorize absenteeism classes, the data have
been preprocessed, and four methods of machine learning classification have
been applied: Multinomial Logistic Regression (MLR), Support Vector Machines
(SVM), Artificial Neural Networks (ANN), and Random Forests (RF). We selected
the best model, based on several validation scores, and compared its
performance against the existing model; we then integrated the best model into
our proposed web-based for hiring managers. Findings - A web-based decision
tool allows hiring managers to make more informed decisions before hiring a
potential employee, thus reducing time, financial loss and reducing the
probability of economic insolvency. Originality/value - In this paper, we
propose a model that is trained based on attributes that can be collected
during the hiring process. Furthermore, hiring managers may lack experience in
machine learning or do not have the time to spend developing machine learning
algorithms. Thus, we propose a web-based interactive tool that can be used
without prior knowledge of machine learning algorithms.",2202.03577v1,cs.LG,2022-02-02 03:49:01+00:00,"[arxiv.Result.Author('Gopal Nath'), arxiv.Result.Author('Antoine Harfouche'), arxiv.Result.Author('Austin Coursey'), arxiv.Result.Author('Krishna K. Saha'), arxiv.Result.Author('Srikanth Prabhu'), arxiv.Result.Author('Saptarshi Sengupta')]",
47,Generating Single Peaked Votes,"We discuss how to generate singled peaked votes uniformly from the Impartial
Culture model.",1503.02766v1,cs.GT,2015-03-10 04:15:23+00:00,[arxiv.Result.Author('Toby Walsh')],
48,Normalized Range Voting Broadly Resists Control,"We study the behavior of Range Voting and Normalized Range Voting with
respect to electoral control. Electoral control encompasses attempts from an
election chair to alter the structure of an election in order to change the
outcome. We show that a voting system resists a case of control by proving that
performing that case of control is computationally infeasible. Range Voting is
a natural extension of approval voting, and Normalized Range Voting is a simple
variant which alters each vote to maximize the potential impact of each voter.
We show that Normalized Range Voting has among the largest number of control
resistances among natural voting systems.",1005.5698v3,cs.GT,2010-05-31 15:34:11+00:00,[arxiv.Result.Author('Curtis Menton')],
49,Strategic Voting Under Uncertainty About the Voting Method,"Much of the theoretical work on strategic voting makes strong assumptions
about what voters know about the voting situation. A strategizing voter is
typically assumed to know how other voters will vote and to know the rules of
the voting method. A growing body of literature explores strategic voting when
there is uncertainty about how others will vote. In this paper, we study
strategic voting when there is uncertainty about the voting method. We
introduce three notions of manipulability for a set of voting methods: sure,
safe, and expected manipulability. With the help of a computer program, we
identify voting scenarios in which uncertainty about the voting method may
reduce or even eliminate a voter's incentive to misrepresent her preferences.
Thus, it may be in the interest of an election designer who wishes to reduce
strategic voting to leave voters uncertain about which of several reasonable
voting methods will be used to determine the winners of an election.",1907.09110v1,cs.MA,2019-07-22 03:17:19+00:00,"[arxiv.Result.Author('Wesley H. Holliday'), arxiv.Result.Author('Eric Pacuit')]","EPTCS 297, 2019, pp. 252-272"
50,Vote Delegation and Misbehavior,"We study vote delegation with ""well-behaving"" and ""misbehaving"" agents and
compare it with conventional voting. Typical examples for vote delegation are
validation or governance tasks on blockchains. There is a majority of
well-behaving agents, but they may abstain or delegate their vote to other
agents since voting is costly. Misbehaving agents always vote. We compare
conventional voting allowing for abstention with vote delegation. Preferences
of voters are private information and a positive outcome is achieved if
well-behaving agents win. We illustrate that vote delegation leads to quite
different outcomes than conventional voting with abstention. In particular, we
obtain three insights: First, if the number of misbehaving voters, denoted by f
, is high, both voting methods fail to deliver a positive outcome. Second, if f
takes an intermediate value, conventional voting delivers a positive outcome,
while vote delegation fails with probability one. Third, if f is low,
delegation delivers a positive outcome with higher probability than
conventional voting. Finally, our results characterize worst-case outcomes that
can happen in a liquid democracy.",2102.08823v2,cs.GT,2021-02-17 15:32:32+00:00,"[arxiv.Result.Author('Hans Gersbach'), arxiv.Result.Author('Akaki Mamageishvili'), arxiv.Result.Author('Manvir Schneider')]",
51,Voting Power of Teams Working Together,"Voting power determines the ""power"" of individuals who cast votes; their
power is based on their ability to influence the winning-ness of a coalition.
Usually each individual acts alone, casting either all or none of their votes
and is equally likely to do either. This paper extends this standard ""random
voting"" model to allow probabilistic voting, partial voting, and correlated
team voting. We extend the standard Banzhaf metric to account for these cases;
our generalization reduces to the standard metric under ""random voting"", This
new paradigm allows us to answer questions such as ""In the 2013 US Senate, how
much more unified would the Republicans have to be in order to have the same
power as the Democrats in attaining cloture?""",1312.3394v1,cs.GT,2013-12-12 03:19:17+00:00,[arxiv.Result.Author('Daniel Zwillinger')],
52,The Computational Impact of Partial Votes on Strategic Voting,"In many real world elections, agents are not required to rank all candidates.
We study three of the most common methods used to modify voting rules to deal
with such partial votes. These methods modify scoring rules (like the Borda
count), elimination style rules (like single transferable vote) and rules based
on the tournament graph (like Copeland) respectively. We argue that with an
elimination style voting rule like single transferable vote, partial voting
does not change the situations where strategic voting is possible. However,
with scoring rules and rules based on the tournament graph, partial voting can
increase the situations where strategic voting is possible. As a consequence,
the computational complexity of computing a strategic vote can change. For
example, with Borda count, the complexity of computing a strategic vote can
decrease or stay the same depending on how we score partial votes.",1405.7714v1,cs.GT,2014-05-28 12:13:52+00:00,"[arxiv.Result.Author('Nina Narodytska'), arxiv.Result.Author('Toby Walsh')]",
53,FASTEN: Fair and Secure Distributed Voting Using Smart Contracts,"Electing democratic representatives via voting has been a common mechanism
since the 17th century. However, these mechanisms raise concerns about
fairness, privacy, vote concealment, fair calculations of tally, and proxies
voting on their behalf for the voters. Ballot voting, and in recent times,
electronic voting via electronic voting machines (EVMs) improves fairness by
relying on centralized trust. Homomorphic encryption-based voting protocols
also assure fairness but cannot scale to large scale elections such as
presidential elections. In this paper, we leverage the blockchain technology of
distributing trust to propose a smart contract-based protocol, namely, \proto.
There are many existing protocols for voting using smart contracts. We observe
that these either are not scalable or leak the vote tally during the voting
stage, i.e., do not provide vote concealment. In contrast, we show that FASTEN
preserves voter's privacy ensures vote concealment, immutability, and avoids
double voting. We prove that the probability of privacy breaches is negligibly
small. Further, our cost analysis of executing FASTEN over Ethereum is
comparable to most of the existing cost of elections.",2102.10594v1,cs.CR,2021-02-21 12:29:23+00:00,"[arxiv.Result.Author('Sankarshan Damle'), arxiv.Result.Author('Sujit Gujar'), arxiv.Result.Author('Moin Hussain Moti')]",
54,"Feature Engineering for US State Legislative Hearings: Stance, Affiliation, Engagement and Absentees","In US State government legislatures, most of the activity occurs in
committees made up of lawmakers discussing bills. When analyzing, classifying
or summarizing these committee proceedings, some important features become
broadly interesting. In this paper, we engineer four useful features, two
applying to lawmakers (engagement and absence), and two to non-lawmakers
(stance and affiliation). We propose a system to automatically track the
affiliation of organizations in public comments and whether the organizational
representative supports or opposes the bill. The model tracking affiliation
achieves an F1 of 0.872 while the support determination has an F1 of 0.979.
Additionally, a metric to compute legislator engagement and absenteeism is also
proposed and as proof-of-concept, a list of the most and least engaged
legislators over one full California legislative session is presented.",2109.08855v1,cs.IR,2021-09-18 06:50:35+00:00,"[arxiv.Result.Author('Josh Grace'), arxiv.Result.Author('Foaad Khosmood')]",
55,Exploring Weak Strategy-Proofness in Voting Theory,"Voting is the aggregation of individual preferences in order to select a
winning alternative. Selection of a winner is accomplished via a voting rule,
e.g., rank-order voting, majority rule, plurality rule, approval voting. Which
voting rule should be used? In social choice theory, desirable properties of
voting rules are expressed as axioms to be satisfied. This thesis focuses on
axioms concerning strategic manipulation by voters. Sometimes, voters may
intentionally misstate their true preferences in order to alter the outcome for
their own advantage. For example, in plurality rule, if a voter knows that
their top-choice candidate will lose, then they might instead vote for their
second-choice candidate just to avoid an even less desirable result. When no
coalition of voters can strategically manipulate, then the voting rule is said
to satisfy the axiom of Strategy-Proofness. A less restrictive axiom is Weak
Strategy-Proofness (as defined by Dasgupta and Maskin (2019)), which allows for
strategic manipulation by all but the smallest coalitions. Under certain
intuitive conditions, Dasgupta and Maskin (2019) proved that the only voting
rules satisfying Strategy-Proofness are rank-order voting and majority rule. In
my thesis, I generalize their result, by proving that rank-order voting and
majority rule are surprisingly still the only voting rules satisfying Weak
Strategy-Proofness.",2005.07521v1,econ.TH,2020-05-13 19:53:08+00:00,[arxiv.Result.Author('Anne Carlstein')],
