,Title,Summary,DOI,Categories,Publish Time,Authors,Journal
90,Transparent Voting Platform Based on Permissioned Blockchain,"Since 2004, different research was handling the challenges in the centralized
voting systems, e-voting protocols and recently the decentralized voting. So
electronic voting puts forward some difficulties regarding the voter anonymity,
the secure casting of the votes and to prevent the voting process from
frauding. The Decentralized property of the technology called ""blockchain""
could have the solution for many of the challenges in voting research area and
brings a new secure mechanism of safe and transparent voting. In this paper, a
broad comparison between ongoing voting systems has studied by analyzing their
structure and the drawbacks that should consider in future to improve the whole
election process from keeping the privacy of the voter, casting a vote with the
possibility to check if it was counted correctly to publishing the results. The
result of the paper will give a new approach to extend the target of the
election from small scale to large scale despite the fact of Ethereum
limitation which can cast on the blockchain just five votes per minute. The
primary challenge is to find an answer for this question: ""How to balance
between voter privacy and transparency without breaking the important rule
where the voter can proof for a specific candidate that he voted for him in a
bribe situation?"".",1802.10134v1,cs.CY,2018-02-22 14:20:35+00:00,[arxiv.Result.Author('Nazim Faour')],
91,You can do RLAs for IRV,"The City and County of San Francisco, CA, has used Instant Runoff Voting
(IRV) for some elections since 2004. This report describes the first ever
process pilot of Risk Limiting Audits for IRV, for the San Francisco District
Attorney's race in November, 2019. We found that the vote-by-mail outcome could
be efficiently audited to well under the 0.05 risk limit given a sample of only
200 ballots. All the software we developed for the pilot is open source.",2004.00235v1,cs.CY,2020-04-01 05:05:37+00:00,"[arxiv.Result.Author('Michelle Blom'), arxiv.Result.Author('Andrew Conway'), arxiv.Result.Author('Dan King'), arxiv.Result.Author('Laurent Sandrolini'), arxiv.Result.Author('Philip B. Stark'), arxiv.Result.Author('Peter J. Stuckey'), arxiv.Result.Author('Vanessa Teague')]",
92,Integration of a machine learning model into a decision support tool to predict absenteeism at work of prospective employees,"Purpose - Inefficient hiring may result in lower productivity and higher
training costs. Productivity losses caused by absenteeism at work cost U.S.
employers billions of dollars each year. Also, employers typically spend a
considerable amount of time managing employees who perform poorly. The purpose
of this study is to develop a decision support tool to predict absenteeism
among potential employees. Design/methodology/approach - We utilized a popular
open-access dataset. In order to categorize absenteeism classes, the data have
been preprocessed, and four methods of machine learning classification have
been applied: Multinomial Logistic Regression (MLR), Support Vector Machines
(SVM), Artificial Neural Networks (ANN), and Random Forests (RF). We selected
the best model, based on several validation scores, and compared its
performance against the existing model; we then integrated the best model into
our proposed web-based for hiring managers. Findings - A web-based decision
tool allows hiring managers to make more informed decisions before hiring a
potential employee, thus reducing time, financial loss and reducing the
probability of economic insolvency. Originality/value - In this paper, we
propose a model that is trained based on attributes that can be collected
during the hiring process. Furthermore, hiring managers may lack experience in
machine learning or do not have the time to spend developing machine learning
algorithms. Thus, we propose a web-based interactive tool that can be used
without prior knowledge of machine learning algorithms.",2202.03577v1,cs.LG,2022-02-02 03:49:01+00:00,"[arxiv.Result.Author('Gopal Nath'), arxiv.Result.Author('Antoine Harfouche'), arxiv.Result.Author('Austin Coursey'), arxiv.Result.Author('Krishna K. Saha'), arxiv.Result.Author('Srikanth Prabhu'), arxiv.Result.Author('Saptarshi Sengupta')]",
93,MAIL: Malware Analysis Intermediate Language,"This paper introduces and presents a new language named MAIL (Malware
Analysis Intermediate Language). MAIL is basically used for building malware
analysis and detection tools. MAIL provides an abstract representation of an
assembly program and hence the ability of a tool to automate malware analysis
and detection. By translating binaries compiled for different platforms to
MAIL, a tool can achieve platform independence. Each MAIL statement is
annotated with patterns that can be used by a tool to optimize malware analysis
and detection.",2211.03068v1,cs.CR,2022-11-06 09:48:06+00:00,[arxiv.Result.Author('Shahid Alam')],
94,The Computational Impact of Partial Votes on Strategic Voting,"In many real world elections, agents are not required to rank all candidates.
We study three of the most common methods used to modify voting rules to deal
with such partial votes. These methods modify scoring rules (like the Borda
count), elimination style rules (like single transferable vote) and rules based
on the tournament graph (like Copeland) respectively. We argue that with an
elimination style voting rule like single transferable vote, partial voting
does not change the situations where strategic voting is possible. However,
with scoring rules and rules based on the tournament graph, partial voting can
increase the situations where strategic voting is possible. As a consequence,
the computational complexity of computing a strategic vote can change. For
example, with Borda count, the complexity of computing a strategic vote can
decrease or stay the same depending on how we score partial votes.",1405.7714v1,cs.GT,2014-05-28 12:13:52+00:00,"[arxiv.Result.Author('Nina Narodytska'), arxiv.Result.Author('Toby Walsh')]",
95,Verification of the Socio-Technical Aspects of Voting: The Case of the Polish Postal Vote 2020,"Voting procedures are designed and implemented by people, for people, and
with significant human involvement. Thus, one should take into account the
human factors in order to comprehensively analyze properties of an election and
detect threats. In particular, it is essential to assess how actions and
strategies of the involved agents (voters, municipal office employees, mail
clerks) can influence the outcome of other agents' actions as well as the
overall outcome of the election. In this paper, we present our first attempt to
capture those aspects in a formal multi-agent model of the Polish presidential
election 2020. The election marked the first time when postal vote was
universally available in Poland. Unfortunately, the voting scheme was prepared
under time pressure and political pressure, and without the involvement of
experts. This might have opened up possibilities for various kinds of ballot
fraud, in-house coercion, etc. We propose a preliminary scalable model of the
procedure in the form of a Multi-Agent Graph, and formalize selected integrity
and security properties by formulas of agent logics. Then, we transform the
models and formulas so that they can be input to the state-of-art model checker
Uppaal. The first series of experiments demonstrates that verification scales
rather badly due to the state-space explosion. However, we show that a recently
developed technique of user-friendly model reduction by variable abstraction
allows us to verify more complex scenarios.",2210.10694v1,cs.MA,2022-10-19 16:15:53+00:00,"[arxiv.Result.Author('Wojciech Jamroga'), arxiv.Result.Author('Peter Y. A. Ryan'), arxiv.Result.Author('Yan Kim')]",
96,A Trustworthy Electronic Voting System for Australian Federal Elections,"The existing system for determining election results in Australia is, for the
most part, secure, accurate and understandable by the average voter. This
thesis explores the design of electronic voting systems designed to achieve
these same goals, while also improving on the existing system in the areas of
counting speed, accuracy, tamper resistance and accessibility.
  Electronic voting systems have seen limited use within Australian elections,
most prominently for State Elections in Victoria (2014), New South Wales (2015)
and Western Australia (2017), along with trials of electronic voting systems in
federal elections in 2007.
  This thesis presents an analysis of the iVote electronic voting system used
for the 2017 Western Australian State Election (iVote WA), outlining a number
of security risks introduced by the use of cloud-based distributed denial of
service mitigation. In addition, this thesis presents the results of a
cross-sectional survey of Australian voters regarding levels of trust for three
voting systems: the existing paper-based system used for Australian federal
elections, the iVote WA system, and the vVote system used for the 2014
Victorian State Election.
  The analysis of iVote, combined with the survey results, are used to inform a
recommendation for future research and public policy regarding the use of
electronic voting systems in Australian federal elections.",1805.02202v1,cs.CR,2018-05-06 12:41:10+00:00,[arxiv.Result.Author('Mark Eldridge')],
97,Protecting Elections by Recounting Ballots,"Complexity of voting manipulation is a prominent topic in computational
social choice. In this work, we consider a two-stage voting manipulation
scenario. First, a malicious party (an attacker) attempts to manipulate the
election outcome in favor of a preferred candidate by changing the vote counts
in some of the voting districts. Afterwards, another party (a defender), which
cares about the voters' wishes, demands a recount in a subset of the
manipulated districts, restoring their vote counts to their original values. We
investigate the resulting Stackelberg game for the case where votes are
aggregated using two variants of the Plurality rule, and obtain an almost
complete picture of the complexity landscape, both from the attacker's and from
the defender's perspective.",1906.07071v1,cs.GT,2019-06-17 14:59:08+00:00,"[arxiv.Result.Author('Edith Elkind'), arxiv.Result.Author('Jiarui Gan'), arxiv.Result.Author('Svetlana Obraztsova'), arxiv.Result.Author('Zinovi Rabinovich'), arxiv.Result.Author('Alexandros A. Voudouris')]",
98,Quantum anonymous voting with anonymity check,"We propose a new protocol for quantum anonymous voting having serious
advantages over the existing protocols: it protects both the voters from a
curious tallyman and all the participants from a dishonest voter in
unconditional way. The central idea of the protocol is that the ballots are
given back to the voters after the voting process, which gives a possibility
for two voters to check the anonymity of the vote counting process by preparing
a special entangled state of two ballots. Any attempt of cheating from the side
of the tallyman results in destroying the entanglement, which can be detected
by the voters.",0911.5605v1,quant-ph,2009-11-30 10:39:14+00:00,"[arxiv.Result.Author('Dmitri Horoshko'), arxiv.Result.Author('Sergei Kilin')]","Physics Letters A 375, 1172-1175 (2011)"
99,A Neural Phillips Curve and a Deep Output Gap,"Many problems plague the estimation of Phillips curves. Among them is the
hurdle that the two key components, inflation expectations and the output gap,
are both unobserved. Traditional remedies include creating reasonable proxies
for the notable absentees or extracting them via some form of assumptions-heavy
filtering procedure. I propose an alternative route: a Hemisphere Neural
Network (HNN) whose peculiar architecture yields a final layer where components
can be interpreted as latent states within a Neural Phillips Curve. There are
benefits. First, HNN conducts the supervised estimation of nonlinearities that
arise when translating a high-dimensional set of observed regressors into
latent states. Second, computations are fast. Third, forecasts are economically
interpretable. Fourth, inflation volatility can also be predicted by merely
adding a hemisphere to the model. Among other findings, the contribution of
real activity to inflation appears severely underestimated in traditional
econometric specifications. Also, HNN captures out-of-sample the 2021 upswing
in inflation and attributes it first to an abrupt and sizable disanchoring of
the expectations component, followed by a wildly positive gap starting from
late 2020. HNN's gap unique path comes from dispensing with unemployment and
GDP in favor of an amalgam of nonlinearly processed alternative tightness
indicators -- some of which are skyrocketing as of early 2022.",2202.04146v1,econ.EM,2022-02-08 21:10:09+00:00,[arxiv.Result.Author('Philippe Goulet Coulombe')],
100,On Covering a Solid Sphere with Concentric Spheres in ${\mathbb Z}^3$,"We show that a digital sphere, constructed by the circular sweep of a digital
semicircle (generatrix) around its diameter, consists of some holes
(absentee-voxels), which appear on its spherical surface of revolution. This
incompleteness calls for a proper characterization of the absentee-voxels whose
restoration will yield a complete spherical surface without any holes. In this
paper, we present a characterization of such absentee-voxels using certain
techniques of digital geometry and show that their count varies quadratically
with the radius of the semicircular generatrix. Next, we design an algorithm to
fill these absentee-voxels so as to generate a spherical surface of revolution,
which is more realistic from the viewpoint of visual perception. We further
show that covering a solid sphere by a set of complete spheres also results in
an asymptotically larger count of absentees, which is cubic in the radius of
the sphere. The characterization and generation of complete solid spheres
without any holes can also be accomplished in a similar fashion. We furnish
test results to substantiate our theoretical findings.",1411.1395v1,cs.CG,2014-10-23 05:05:23+00:00,"[arxiv.Result.Author('Sahadev Bera'), arxiv.Result.Author('Partha Bhowmick'), arxiv.Result.Author('Bhargab B. Bhattacharya')]",
101,Physical Cryptographic Signatures for Absentee Ballots,"Physical signature verification on absentee ballots became a major flashpoint
in the 2018 midterm elections in the United States, especially in states like
Georgia, Florida, and Arizona, where close election margins resulted in
heightened attention to the counting of absentee ballots. As vote-by-mail
solutions are becoming more prevalent across the U.S., these issues are sure to
continue affecting elections in the United States. Signature verification is an
inexact science; often times guidelines can vary widely from jurisdiction to
jurisdiction. In this paper we provide a cryptographic remedy to this solution
that is usable, secure, and easily integrated into existing election
infrastructure.",1812.09423v1,cs.CR,2018-12-22 00:43:31+00:00,[arxiv.Result.Author('Matthew Bernhard')],
102,Nurse Staffing under Absenteeism: A Distributionally Robust Optimization Approach,"We study the nurse staffing problem under random nurse demand and
absenteeism. While the demand uncertainty is exogenous (stemming from the
random patient census), the absenteeism uncertainty is \emph{endogenous}, i.e.,
the number of nurses who show up for work partially depends on the nurse
staffing level. For quality of care, many hospitals have developed float pools,
i.e., groups of hospital units, and trained nurses to be able to work in
multiple units (termed cross-training) in response to potential nurse shortage.
In this paper, we propose a distributionally robust nurse staffing (DRNS) model
that considers both exogenous and endogenous uncertainties. We derive a
separation algorithm to solve this model under a general structure of float
pools. In addition, we identify several pool structures that often arise in
practice and recast the corresponding DRNS model as a mixed-integer linear
program, which facilitates off-the-shelf commercial solvers. Furthermore, we
optimize the float pool design to reduce cross-training while achieving
specified target staffing costs. The numerical case studies, based on the data
of a collaborating hospital, suggest that the units with high absenteeism
probability should be pooled together.",1909.09875v2,math.OC,2019-09-21 19:15:54+00:00,"[arxiv.Result.Author('Minseok Ryu'), arxiv.Result.Author('Ruiwei Jiang')]",
103,On the Bee-Identification Error Exponent with Absentee Bees,"The ""bee-identification problem"" was formally defined by Tandon, Tan and
Varshney [IEEE Trans. Commun. (2019) [Online early access]], and the error
exponent was studied. This work extends the results for the ""absentee bees""
scenario, where a small fraction of the bees are absent in the beehive image
used for identification. For this setting, we present an exact characterization
of the bee-identification error exponent, and show that independent barcode
decoding is optimal, i.e., joint decoding of the bee barcodes does not result
in a better error exponent relative to independent decoding of each noisy
barcode. This is in contrast to the result without absentee bees, where joint
barcode decoding results in a significantly higher error exponent than
independent barcode decoding. We also define and characterize the ""capacity""
for the bee-identification problem with absentee bees, and prove the strong
converse for the same.",1910.10333v1,cs.IT,2019-10-23 03:57:35+00:00,"[arxiv.Result.Author('Anshoo Tandon'), arxiv.Result.Author('Vincent Y. F. Tan'), arxiv.Result.Author('Lav R. Varshney')]",
104,Integration of a machine learning model into a decision support tool to predict absenteeism at work of prospective employees,"Purpose - Inefficient hiring may result in lower productivity and higher
training costs. Productivity losses caused by absenteeism at work cost U.S.
employers billions of dollars each year. Also, employers typically spend a
considerable amount of time managing employees who perform poorly. The purpose
of this study is to develop a decision support tool to predict absenteeism
among potential employees. Design/methodology/approach - We utilized a popular
open-access dataset. In order to categorize absenteeism classes, the data have
been preprocessed, and four methods of machine learning classification have
been applied: Multinomial Logistic Regression (MLR), Support Vector Machines
(SVM), Artificial Neural Networks (ANN), and Random Forests (RF). We selected
the best model, based on several validation scores, and compared its
performance against the existing model; we then integrated the best model into
our proposed web-based for hiring managers. Findings - A web-based decision
tool allows hiring managers to make more informed decisions before hiring a
potential employee, thus reducing time, financial loss and reducing the
probability of economic insolvency. Originality/value - In this paper, we
propose a model that is trained based on attributes that can be collected
during the hiring process. Furthermore, hiring managers may lack experience in
machine learning or do not have the time to spend developing machine learning
algorithms. Thus, we propose a web-based interactive tool that can be used
without prior knowledge of machine learning algorithms.",2202.03577v1,cs.LG,2022-02-02 03:49:01+00:00,"[arxiv.Result.Author('Gopal Nath'), arxiv.Result.Author('Antoine Harfouche'), arxiv.Result.Author('Austin Coursey'), arxiv.Result.Author('Krishna K. Saha'), arxiv.Result.Author('Srikanth Prabhu'), arxiv.Result.Author('Saptarshi Sengupta')]",
105,Response to Office of the Privacy Commissioner of Canada Consultation Proposals pertaining to amendments to PIPEDA relative to Artificial Intelligence,"In February 2020, the Montreal AI Ethics Institute (MAIEI) was invited by the
Office of the Privacy Commissioner of Canada (OPCC) to provide for comments
both at a closed roundtable and in writing on the OPCC consultation proposal
for amendments relative to Artificial Intelligence (AI), to the Canadian
privacy legislation, the Personal Information Protection and Electronic
Documents Act (PIPEDA). The present document includes MAIEI comments and
recommendations in writing. Per MAIEI's mission and mandate to act as a
catalyst for public feedback pertaining to AI Ethics and regulatory technology
developments, as well as to provide for public competence-building workshops on
critical topics in such domains, the reader will also find such public feedback
and propositions by Montrealers who participated at MAIEI's workshops,
submitted as Schedule 1 to the present report. For each of OPCC 12 proposals,
and underlying questions, as described on its website, MAIEI provides a short
reply, a summary list of recommendations, as well as comments relevant to the
question at hand. We leave you with three general statements to keep in mind
while going through the next pages:
  1) AI systems should be used to augment human capacity for meaningful and
purposeful connections and associations, not as a substitute for trust.
  2) Humans have collectively accepted to uphold the rule of law, but for
machines, the code is rule. Where socio-technical systems are deployed to make
important decisions, profiles or inferences about individuals, we will
increasingly have to attempt the difficult exercise of drafting and encoding
our law in a manner learnable by machines.
  3) Let us work collectively towards a world where Responsible AI becomes the
rule, before our socio-technical systems become ""too connected to fail"".",2006.07025v1,cs.CY,2020-06-12 09:20:04+00:00,"[arxiv.Result.Author('Mirka Snyder Caron'), arxiv.Result.Author('Abhishek Gupta')]",
106,"Feature Engineering for US State Legislative Hearings: Stance, Affiliation, Engagement and Absentees","In US State government legislatures, most of the activity occurs in
committees made up of lawmakers discussing bills. When analyzing, classifying
or summarizing these committee proceedings, some important features become
broadly interesting. In this paper, we engineer four useful features, two
applying to lawmakers (engagement and absence), and two to non-lawmakers
(stance and affiliation). We propose a system to automatically track the
affiliation of organizations in public comments and whether the organizational
representative supports or opposes the bill. The model tracking affiliation
achieves an F1 of 0.872 while the support determination has an F1 of 0.979.
Additionally, a metric to compute legislator engagement and absenteeism is also
proposed and as proof-of-concept, a list of the most and least engaged
legislators over one full California legislative session is presented.",2109.08855v1,cs.IR,2021-09-18 06:50:35+00:00,"[arxiv.Result.Author('Josh Grace'), arxiv.Result.Author('Foaad Khosmood')]",
107,Identifying Possible Winners in Ranked Choice Voting Elections with Outstanding Ballots,"Several election districts in the US have recently moved to ranked-choice
voting (RCV) to decide the results of local elections. RCV allows voters to
rank their choices, and the results are computed in rounds, eliminating one
candidate at a time. RCV ensures fairer elections and has been shown to
increase elected representation of women and people of color. A main drawback
of RCV is that the round-by-round process requires all the ballots to be
tallied before the results of an election can be calculated. With increasingly
large portions of ballots coming from absentee voters, RCV election outcomes
are not always apparent on election night, and can take several weeks to be
published, leading to a loss of trust in the electoral process from the public.
In this paper, we present an algorithm for efficiently computing possible
winners of RCV elections from partially known ballots and evaluate it on data
from the recent New York City Primary elections. We show that our techniques
allow to significantly narrow down the field of possible election winners, and
in some case identify the winner as soon as election night despite a number of
yet-unaccounted absentee ballots, providing more transparency in the electoral
process.",2206.12741v1,cs.CY,2022-06-25 22:08:15+00:00,"[arxiv.Result.Author('Alborz Jelvani'), arxiv.Result.Author('Amélie Marian')]",
108,Monitoring and prediction of an epidemic outbreak using syndromic observations,"The paper presents an algorithm for syndromic surveillance of an epidemic
outbreak formulated in the context of stochastic nonlinear filtering. The
dynamics of the epidemic is modeled using a generalized compartmental
epidemiological model with inhomogeneous mixing. The syndromic (typically
non-medical) observations of the number of infected people (e.g. visits to
pharmacies, sale of certain products, absenteeism from work/study etc.) are
used for estimation. The state of the epidemic, including the number of
infected people and the unknown parameters of the model, are estimated via a
particle filter. The numerical results indicate that the proposed framework can
provide useful early prediction of the epidemic peak if the uncertainty in
prior knowledge of model parameters is not excessive.",1110.4696v1,q-bio.QM,2011-10-21 03:27:08+00:00,"[arxiv.Result.Author('Alex Skvortsov'), arxiv.Result.Author('Branko Ristic')]",
