,Title,Summary,DOI,Categories,Publish Time,Authors,Journal
0,Physical Cryptographic Signatures for Absentee Ballots,"Physical signature verification on absentee ballots became a major flashpoint
in the 2018 midterm elections in the United States, especially in states like
Georgia, Florida, and Arizona, where close election margins resulted in
heightened attention to the counting of absentee ballots. As vote-by-mail
solutions are becoming more prevalent across the U.S., these issues are sure to
continue affecting elections in the United States. Signature verification is an
inexact science; often times guidelines can vary widely from jurisdiction to
jurisdiction. In this paper we provide a cryptographic remedy to this solution
that is usable, secure, and easily integrated into existing election
infrastructure.",1812.09423v1,cs.CR,2018-12-22 00:43:31+00:00,[arxiv.Result.Author('Matthew Bernhard')],
1,Identifying Possible Winners in Ranked Choice Voting Elections with Outstanding Ballots,"Several election districts in the US have recently moved to ranked-choice
voting (RCV) to decide the results of local elections. RCV allows voters to
rank their choices, and the results are computed in rounds, eliminating one
candidate at a time. RCV ensures fairer elections and has been shown to
increase elected representation of women and people of color. A main drawback
of RCV is that the round-by-round process requires all the ballots to be
tallied before the results of an election can be calculated. With increasingly
large portions of ballots coming from absentee voters, RCV election outcomes
are not always apparent on election night, and can take several weeks to be
published, leading to a loss of trust in the electoral process from the public.
In this paper, we present an algorithm for efficiently computing possible
winners of RCV elections from partially known ballots and evaluate it on data
from the recent New York City Primary elections. We show that our techniques
allow to significantly narrow down the field of possible election winners, and
in some case identify the winner as soon as election night despite a number of
yet-unaccounted absentee ballots, providing more transparency in the electoral
process.",2206.12741v1,cs.CY,2022-06-25 22:08:15+00:00,"[arxiv.Result.Author('Alborz Jelvani'), arxiv.Result.Author('Amélie Marian')]",
2,Blocks as geographic discontinuities: The effect of polling place assignment on voting,"A potential voter must incur a number of costs in order to successfully cast
an in-person ballot, including the costs associated with identifying and
traveling to a polling place. In order to investigate how these costs affect
voting behavior, we introduce two quasi-experimental designs that can be used
to study how the political participation of registered voters is affected by
differences in the relative distance that registrants must travel to their
assigned Election Day polling place and whether their polling place remains at
the same location as in a previous election. Our designs make comparisons of
registrants who live on the same residential block, but are assigned to vote at
different polling places. We find that living farther from a polling place and
being assigned to a new polling place reduce in-person Election Day voting, but
that registrants largely offset for this by casting more early in-person and
mail ballots.",2105.01728v1,stat.AP,2021-05-04 19:50:27+00:00,"[arxiv.Result.Author('Sabina Tomkins'), arxiv.Result.Author('Keniel Yao'), arxiv.Result.Author('Johann Gaebler'), arxiv.Result.Author('Tobias Konitzer'), arxiv.Result.Author('David Rothschild'), arxiv.Result.Author('Marc Meredith'), arxiv.Result.Author('Sharad Goel')]",
3,On Covering a Solid Sphere with Concentric Spheres in ${\mathbb Z}^3$,"We show that a digital sphere, constructed by the circular sweep of a digital
semicircle (generatrix) around its diameter, consists of some holes
(absentee-voxels), which appear on its spherical surface of revolution. This
incompleteness calls for a proper characterization of the absentee-voxels whose
restoration will yield a complete spherical surface without any holes. In this
paper, we present a characterization of such absentee-voxels using certain
techniques of digital geometry and show that their count varies quadratically
with the radius of the semicircular generatrix. Next, we design an algorithm to
fill these absentee-voxels so as to generate a spherical surface of revolution,
which is more realistic from the viewpoint of visual perception. We further
show that covering a solid sphere by a set of complete spheres also results in
an asymptotically larger count of absentees, which is cubic in the radius of
the sphere. The characterization and generation of complete solid spheres
without any holes can also be accomplished in a similar fashion. We furnish
test results to substantiate our theoretical findings.",1411.1395v1,cs.CG,2014-10-23 05:05:23+00:00,"[arxiv.Result.Author('Sahadev Bera'), arxiv.Result.Author('Partha Bhowmick'), arxiv.Result.Author('Bhargab B. Bhattacharya')]",
4,Limiting Risk by Turning Manifest Phantoms into Evil Zombies,"Drawing a random sample of ballots to conduct a risk-limiting audit generally
requires knowing how the ballots cast in an election are organized into groups,
for instance, how many containers of ballots there are in all and how many
ballots are in each container. A list of the ballot group identifiers along
with number of ballots in each group is called a ballot manifest. What if the
ballot manifest is not accurate? Surprisingly, even if ballots are known to be
missing from the manifest, it is not necessary to make worst-case assumptions
about those ballots--for instance, to adjust the margin by the number of
missing ballots--to ensure that the audit remains conservative. Rather, it
suffices to make worst-case assumptions about the individual randomly selected
ballots that the audit cannot find. This observation provides a simple
modification to some risk-limiting audit procedures that makes them
automatically become more conservative if the ballot manifest has errors. The
modification--phantoms to evil zombies (~2EZ)--requires only an upper bound on
the total number of ballots cast. ~2EZ makes the audit P-value stochastically
larger than it would be had the manifest been accurate, automatically requiring
more than enough ballots to be audited to offset the manifest errors. This
ensures that the true risk limit remains smaller than the nominal risk limit.
On the other hand, if the manifest is in fact accurate and the upper bound on
the total number of ballots equals the total according to the manifest, ~2EZ
has no effect at all on the number of ballots audited nor on the true risk
limit.",1207.3413v1,stat.AP,2012-07-14 11:26:02+00:00,"[arxiv.Result.Author('Jorge H. Banuelos'), arxiv.Result.Author('Philip B. Stark')]",
5,A Complete Enumeration of Ballot Permutations Avoiding Sets of Small Patterns,"Permutations whose prefixes contain at least as many ascents as descents are
called ballot permutations. Lin, Wang, and Zhao have previously enumerated
ballot permutations avoiding small patterns and have proposed the problem of
enumerating ballot permutations avoiding a pair of permutations of length $3$.
We completely enumerate ballot permutations avoiding two patterns of length $3$
and we relate these avoidance classes with their respective recurrence
relations and formulas, which leads to an interesting bijection between ballot
permutations avoiding $132$ and $312$ with left factors of Dyck paths. In
addition, we also conclude the Wilf-classification of ballot permutations
avoiding sets of two patterns of length $3$, and we then extend our results to
completely enumerate ballot permutations avoiding three patterns of length $3$.",2209.06087v1,math.CO,2022-09-13 15:37:45+00:00,[arxiv.Result.Author('Nathan Sun')],
6,Electt: running auditable and verifiable elections in untrusted environments,"We present a system for running auditable and verifiable elections in
untrusted environments. Votes are anonymous since the order of candidates on a
ballot sheet is random. Tellers see only the position of the candidate. Voters
can check their vote. An election is auditable using blockchain log.
Threshold-encryption, which is used to implement the quorum, prevents a
deadlock from occurring if a minority of candidates or observers tries to
sabotage the election. Candidates and observers can indicate that the election
was free and fair by exposing their keys, which are used by the system to
decrypt each vote. Ballot sheets are encrypted by onion-routing, which has a
layer with the key of the election instance, so it's impossible for a quorum to
decode the results before they have announced their decision by exposing their
keys. A register of voters ensures that only verified voters can vote without
compromising their identity. If there any doubts about the identity of a voter,
their vote can be excluded from the election, if a quorum agrees. This system
is designed to scale from one instance to a distributed system that runs over
an unlimited number of instances, which can be achieved using cloud instances
or smartphones belonging to voters or tellers.",2011.10902v2,cs.CR,2020-11-22 00:58:34+00:00,[arxiv.Result.Author('Kirill A. Korinsky')],
7,Can Voters Detect Errors on Their Printed Ballots? Absolutely,"There is still debate on whether voters can detect malicious changes in their
printed ballot after making their selections on a Ballot Marking Device (BMD).
In this study, we altered votes on a voter's ballot after they had made their
selections on a BMD. We then required them to examine their ballots for any
changes from the slate they used to vote. Overall accuracy was exceptionally
high. Participants saw 1440 total contests, and of those 1440, there were a
total of 4 errors, so total accuracy was 99.8%. Participants were able to
perform with near-perfect accuracy regardless of ballot length, ballot type,
number of altered races, and location of altered races. Detection performance
was extremely robust. We conclude that with proper direction and resources,
voters can be near-perfect detectors of ballot changes on printed paper ballots
after voting with a BMD. This finding has significant implications for the
voting community as BMD use continues to grow. Research should now focus on
identifying administrative and behavioral methods that will prompt and
encourage voters to check their BMD-generated ballots before they drop them in
the ballot box.",2204.09780v1,cs.HC,2022-04-20 20:40:32+00:00,"[arxiv.Result.Author('Philip Kortum'), arxiv.Result.Author('Michael D. Byrne'), arxiv.Result.Author('Chidera O. Azubike'), arxiv.Result.Author('Laura E. Roty')]",
8,Nurse Staffing under Absenteeism: A Distributionally Robust Optimization Approach,"We study the nurse staffing problem under random nurse demand and
absenteeism. While the demand uncertainty is exogenous (stemming from the
random patient census), the absenteeism uncertainty is \emph{endogenous}, i.e.,
the number of nurses who show up for work partially depends on the nurse
staffing level. For quality of care, many hospitals have developed float pools,
i.e., groups of hospital units, and trained nurses to be able to work in
multiple units (termed cross-training) in response to potential nurse shortage.
In this paper, we propose a distributionally robust nurse staffing (DRNS) model
that considers both exogenous and endogenous uncertainties. We derive a
separation algorithm to solve this model under a general structure of float
pools. In addition, we identify several pool structures that often arise in
practice and recast the corresponding DRNS model as a mixed-integer linear
program, which facilitates off-the-shelf commercial solvers. Furthermore, we
optimize the float pool design to reduce cross-training while achieving
specified target staffing costs. The numerical case studies, based on the data
of a collaborating hospital, suggest that the units with high absenteeism
probability should be pooled together.",1909.09875v2,math.OC,2019-09-21 19:15:54+00:00,"[arxiv.Result.Author('Minseok Ryu'), arxiv.Result.Author('Ruiwei Jiang')]",
9,On the Bee-Identification Error Exponent with Absentee Bees,"The ""bee-identification problem"" was formally defined by Tandon, Tan and
Varshney [IEEE Trans. Commun. (2019) [Online early access]], and the error
exponent was studied. This work extends the results for the ""absentee bees""
scenario, where a small fraction of the bees are absent in the beehive image
used for identification. For this setting, we present an exact characterization
of the bee-identification error exponent, and show that independent barcode
decoding is optimal, i.e., joint decoding of the bee barcodes does not result
in a better error exponent relative to independent decoding of each noisy
barcode. This is in contrast to the result without absentee bees, where joint
barcode decoding results in a significantly higher error exponent than
independent barcode decoding. We also define and characterize the ""capacity""
for the bee-identification problem with absentee bees, and prove the strong
converse for the same.",1910.10333v1,cs.IT,2019-10-23 03:57:35+00:00,"[arxiv.Result.Author('Anshoo Tandon'), arxiv.Result.Author('Vincent Y. F. Tan'), arxiv.Result.Author('Lav R. Varshney')]",
10,Ballot tilings and increasing trees,"We study enumerations of Dyck and ballot tilings, which are tilings of a
region determined by two Dyck or ballot paths. We give bijective proofs to two
formulae of enumerations of Dyck tilings through Hermite histories. We show
that one of the formulae is equal to a certain Kazhdan--Lusztig polynomial. For
a ballot tiling, we establish formulae which are analogues of formulae for Dyck
tilings. Especially, the generating functions have factorized expressions. The
key tool is a planted plane tree and its increasing labellings. We also
introduce a generalized perfect matching which is bijective to an Hermite
history for a ballot tiling. By combining these objects, we obtain various
expressions of a generating function of ballot tilings with a fixed lower path.",1705.06434v1,math-ph,2017-05-18 06:46:09+00:00,[arxiv.Result.Author('Keiichi Shigechi')],
11,Sophisticated Attacks on Decoy Ballots: The Devil's Menu and the Market for Lemons,"Decoy ballots do not count in election outcomes, but otherwise they are
indistinguishable from real ballots. By means of a game-theoretical model, we
show that decoy ballots may not provide effective protection against a
malevolent adversary trying to buy real ballots. If the citizenry is divided
into subgroups (or districts), the adversary can construct a so-called ""Devil's
Menu"" consisting of several prices. In equilibrium, the adversary can buy the
real ballots of any strict subset of districts at a price corresponding to the
willingness to sell on the part of the citizens holding such ballots. By
contrast, decoy voters are trapped into selling their ballots at a low, or even
negligible, price. Blowing up the adversary's budget by introducing decoy
ballots may thus turn out to be futile. The Devil's Menu can also be applied to
the well-known ""Lemons Problem"".",1712.05477v1,cs.GT,2017-12-14 23:54:58+00:00,"[arxiv.Result.Author('Hans Gersbach'), arxiv.Result.Author('Akaki Mamageishvili'), arxiv.Result.Author('Oriol Tejada')]",
12,The ATHENA Class of Risk-Limiting Ballot Polling Audits,"The main risk-limiting ballot polling audit in use today, BRAVO, is designed
for use when single ballots are drawn at random and a decision regarding
whether to stop the audit or draw another ballot is taken after each ballot
draw (ballot-by-ballot (B2) audits). On the other hand, real ballot polling
audits draw many ballots in a single round before determining whether to stop
(round-by-round (R2) audits). We show that BRAVO results in significant
inefficiency when directly applied to real R2 audits. We present the ATHENA
class of R2 stopping rules, which we show are risk-limiting if the round
schedule is pre-determined (before the audit begins). We prove that each rule
is at least as efficient as the corresponding BRAVO stopping rule applied at
the end of the round. We have open-source software libraries implementing most
of our results.
  We show that ATHENA halves the number of ballots required, for all state
margins in the 2016 US Presidential election and a first round with $90\%$
stopping probability, when compared to BRAVO (stopping rule applied at the end
of the round). We present simulation results supporting the 90% stopping
probability claims and our claims for the risk accrued in the first round.
Further, ATHENA reduces the number of ballots by more than a quarter for low
margins, when compared to the BRAVO stopping rule applied on ballots in
selection order. This implies that keeping track of the order when drawing
ballots R2 is not beneficial, because ATHENA is more efficient even without
information on selection order. These results are significant because current
approaches to real ballot polling election audits use the B2 BRAVO rules,
requiring about twice as much work on the part of election officials. Applying
the rules in selection order requires fewer ballots, but keeping track of the
order, and entering it into audit software, adds to the effort.",2008.02315v5,cs.CR,2020-08-05 18:47:37+00:00,"[arxiv.Result.Author('Filip Zagórski'), arxiv.Result.Author('Grant McClearn'), arxiv.Result.Author('Sarah Morin'), arxiv.Result.Author('Neal McBurnett'), arxiv.Result.Author('Poorvi L. Vora')]",
13,Integration of a machine learning model into a decision support tool to predict absenteeism at work of prospective employees,"Purpose - Inefficient hiring may result in lower productivity and higher
training costs. Productivity losses caused by absenteeism at work cost U.S.
employers billions of dollars each year. Also, employers typically spend a
considerable amount of time managing employees who perform poorly. The purpose
of this study is to develop a decision support tool to predict absenteeism
among potential employees. Design/methodology/approach - We utilized a popular
open-access dataset. In order to categorize absenteeism classes, the data have
been preprocessed, and four methods of machine learning classification have
been applied: Multinomial Logistic Regression (MLR), Support Vector Machines
(SVM), Artificial Neural Networks (ANN), and Random Forests (RF). We selected
the best model, based on several validation scores, and compared its
performance against the existing model; we then integrated the best model into
our proposed web-based for hiring managers. Findings - A web-based decision
tool allows hiring managers to make more informed decisions before hiring a
potential employee, thus reducing time, financial loss and reducing the
probability of economic insolvency. Originality/value - In this paper, we
propose a model that is trained based on attributes that can be collected
during the hiring process. Furthermore, hiring managers may lack experience in
machine learning or do not have the time to spend developing machine learning
algorithms. Thus, we propose a web-based interactive tool that can be used
without prior knowledge of machine learning algorithms.",2202.03577v1,cs.LG,2022-02-02 03:49:01+00:00,"[arxiv.Result.Author('Gopal Nath'), arxiv.Result.Author('Antoine Harfouche'), arxiv.Result.Author('Austin Coursey'), arxiv.Result.Author('Krishna K. Saha'), arxiv.Result.Author('Srikanth Prabhu'), arxiv.Result.Author('Saptarshi Sengupta')]",
14,$k$-Cut: A Simple Approximately-Uniform Method for Sampling Ballots in Post-Election Audits,"We present an approximate sampling framework and discuss how risk-limiting
audits can compensate for these approximations, while maintaining their
""risk-limiting"" properties. Our framework is general and can compensate for
counting mistakes made during audits.
  Moreover, we present and analyze a simple approximate sampling
method,""$k$-cut"", for picking a ballot randomly from a stack, without counting.
Our method involves doing $k$ ""cuts"", each involving moving a random portion of
ballots from the top to the bottom of the stack, and then picking the ballot on
top. Unlike conventional methods of picking a ballot at random, $k$-cut does
not require identification numbers on the ballots or counting many ballots per
draw. We analyze how close the distribution of chosen ballots is to the uniform
distribution, and design different mitigation procedures. We show that $k=6$
cuts is enough for an risk-limiting election audit, based on empirical data,
which would provide a significant increase in efficiency.",1811.08811v3,cs.DS,2018-11-21 16:26:33+00:00,"[arxiv.Result.Author('Mayuri Sridhar'), arxiv.Result.Author('Ronald L. Rivest')]",
15,Bernoulli Ballot Polling: A Manifest Improvement for Risk-Limiting Audits,"We present a method and software for ballot-polling risk-limiting audits
(RLAs) based on Bernoulli sampling: ballots are included in the sample with
probability $p$, independently. Bernoulli sampling has several advantages: (1)
it does not require a ballot manifest; (2) it can be conducted independently at
different locations, rather than requiring a central authority to select the
sample from the whole population of cast ballots or requiring stratified
sampling; (3) it can start in polling places on election night, before margins
are known. If the reported margins for the 2016 U.S. Presidential election are
correct, a Bernoulli ballot-polling audit with a risk limit of 5% and a
sampling rate of $p_0 = 1\%$ would have had at least a 99% probability of
confirming the outcome in 42 states. (The other states were more likely to have
needed to examine additional ballots.) Logistical and security advantages that
auditing in the polling place affords may outweigh the cost of examining more
ballots than some other methods might require.",1812.06361v1,stat.AP,2018-12-15 21:57:23+00:00,"[arxiv.Result.Author('Kellie Ottoboni'), arxiv.Result.Author('Matthew Bernhard'), arxiv.Result.Author('J. Alex Halderman'), arxiv.Result.Author('Ronald L. Rivest'), arxiv.Result.Author('Philip B. Stark')]",
16,"Symmetric Dyck tilings, ballot tableaux and tree-like tableaux of shifted shapes","Symmetric Dyck tilings and ballot tilings are certain tilings in the region
surrounded by two ballot paths. We study the relations of combinatorial objects
which are bijective to symmetric Dyck tilings such as labeled trees, Hermite
histories, and perfect matchings. We also introduce two operations on labeled
trees for symmetric Dyck tilings: symmetric Dyck tiling strip (symDTS) and
symmetric Dyck tiling ribbon (symDTR). We give two definitions of Hermite
histories for symmetric Dyck tilings, and show that they are equivalent by use
of the correspondence between symDTS operation and an Hermite history. Since
ballot tilings form a subset in the set of symmetric Dyck tilings, we construct
an inclusive map from labeled trees for ballot tilings to labeled trees for
symmetric Dyck tilings. By this inclusive map, the results for symmetric Dyck
tilings can be applied to those of ballot tilings. We introduce and study the
notions of ballot tableaux and tree-like tableaux of shifted shapes, which are
generalizations of Dyck tableaux and tree-like tableaux, respectively. The
correspondence between ballot tableaux and tree-like tableaux of shifted shapes
is given by using the symDTR operation and the structure of labeled trees for
symmetric Dyck tilings.",2011.07296v1,math.CO,2020-11-14 13:15:14+00:00,[arxiv.Result.Author('Keiichi Shigechi')],
17,SOBA: Secrecy-preserving Observable Ballot-level Audit,"SOBA is an approach to election verification that provides observers with
justifiably high confidence that the reported results of an election are
consistent with an audit trail (""ballots""), which can be paper or electronic.
SOBA combines three ideas: (1) publishing cast vote records (CVRs) separately
for each contest, so that anyone can verify that each reported contest outcome
is correct, if the CVRs reflect voters' intentions with sufficient accuracy;
(2) shrouding a mapping between ballots and the CVRs for those ballots to
prevent the loss of privacy that could occur otherwise; (3) assessing the
accuracy with which the CVRs reflect voters' intentions for a collection of
contests while simultaneously assessing the integrity of the shrouded mapping
between ballots and CVRs by comparing randomly selected ballots to the CVRs
that purport to represent them. Step (1) is related to work by the Humboldt
County Election Transparency Project, but publishing CVRs separately for
individual contests rather than images of entire ballots preserves privacy.
Step (2) requires a cryptographic commitment from elections officials.
Observers participate in step (3), which relies on the ""super-simple
simultaneous single-ballot risk-limiting audit."" Step (3) is designed to reveal
relatively few ballots if the shrouded mapping is proper and the CVRs
accurately reflect voter intent. But if the reported outcomes of the contests
differ from the outcomes that a full hand count would show, step (3) is
guaranteed to have a large chance of requiring all the ballots to be counted by
hand, thereby limiting the risk that an incorrect outcome will become official
and final.",1105.5803v2,stat.AP,2011-05-29 17:00:20+00:00,"[arxiv.Result.Author('Josh Benaloh'), arxiv.Result.Author('Douglas Jones'), arxiv.Result.Author('Eric Lazarus'), arxiv.Result.Author('Mark Lindeman'), arxiv.Result.Author('Philip B. Stark')]",
